id,title,description,availability,condition,price,link,image_link,brand,google_product_category
prod_UNcVV0VXL6dF4nJEIsNcr,MALLORY – Embroidery & Gold Padlock Garter Set - Noir,Kilit. Anahtar. Sır. Katmanlar arasında saklanan bir sır. Merkezde işlevsel altın tonlu mini asma kilitle sabitlenen ince siyah işleme. Yüksek belli jartiyer kemeri aynı donanımı tekrarlar. Dekoratif ve sahiplenen.,in stock,new,106.00 USD,https://mermaidsglance.com/products/yembroiderygoldpadlockgarterset-noirusp_,https://assets.lightfunnels.com/account-99158/images_library/d9d9c8e4-fbef-4efe-a879-94917cda8d18.jpg,MERMAID'S GLANCE,Apparel & Accessories > Clothing > Underwear & Socks > Lingerie
prod_dMADDnmrbSrbhWDvCxy8L,Body Ariel,"Ariel body romantizmle duyusallık arasındaki kusursuz dengeyi taşır. Pastel çiçek danteli şeffaf tül bantlarla birleşerek silüeti uzatır ve beli inceltir. Balenli kaplar göğüs hattını narince biçimlendirirken yüksek kesim kıvrımları zarafetle yükseltir. Yumuşak, aydınlık pudra pembe ton modelin inceliğini vurgular; cazibe gücünden hiçbir şey eksiltmez. Ariel, doğal güzelliği hafiflik ve özgüvenle göstermek için tasarlanmış rafine bir parçadır.",in stock,new,83.00 USD,https://mermaidsglance.com/products/bodyarielTGDf,https://assets.lightfunnels.com/account-99158/images_library/19891a5a-98d0-4f71-b5e5-c8f71b2eead8.jpg,MERMAID'S GLANCE,Apparel & Accessories > Clothing > Underwear & Socks > Lingerie
prod_MG2yQPzKuu7Hhy5P-spku,LEXI – Satin & Silver Ring Strappy Bodysuit - Noir,Saten. Çelik. Biçim. Beden için mimari. Endüstriyel gümüş tonlu halkaların böldüğü parlak siyah saten. Ayarlanabilir askılar. Yapılı kaplar kesin destek sunar. Yüksek bacak kesimi keskin ve uzatan bir silüet kurar.,in stock,new,65.00 USD,https://mermaidsglance.com/products/isatinsilverringstrappybodysuit-noirBewX,https://assets.lightfunnels.com/account-99158/images_library/375bce4e-fb33-4d37-8cc4-91148742579d.jpg,MERMAID'S GLANCE,Apparel & Accessories > Clothing > Underwear & Socks > Lingerie
prod_-bhZ0jN7vahG__NItdFgz,DOMINO – Faux Leather & Gold Chain Strappy Set - Noir,Zincir. Bağ. Komuta. Tavizsiz güç. Islak görünümlü pürüzsüz suni deri ağır altın donanımla buluşur. Çıkarılabilir merkez zinciri göğüs hattını bele bağlar. Anında dikkati talep eden dikey bir ışık çizgisi.,in stock,new,106.00 USD,https://mermaidsglance.com/products/ofauxleathergoldchainstrappyset-noirXjI8,https://assets.lightfunnels.com/account-99158/images_library/e3aeae9a-6607-45d9-8c27-21485c73d391.jpg,MERMAID'S GLANCE,Apparel & Accessories > Clothing > Underwear & Socks > Lingerie
prod_RZmtyWbTPbQDFWOtLII1t,HELENA – Sheer Tulle & Floral Embroidery Plunge Bodysuit - Noir,Derin. V. Gece. İç giyimle hazır giyim arasındaki çizgiyi siler. Narin çiçek işlemesiyle çerçevelenen dramatik derin yaka. Şeffaf tül gövde. Mimari çapraz sırt tasarımı biçimlenmiş bir kalıp sunar. Her açıdan güçlü.,in stock,new,83.00 USD,https://mermaidsglance.com/products/efloralembroideryplungebodysuit-noir1Lq8,https://assets.lightfunnels.com/account-99158/images_library/e2dae375-c419-4ae0-aeb7-c46bd697c7ee.jpg,MERMAID'S GLANCE,Apparel & Accessories > Clothing > Underwear & Socks > Lingerie
prod_zDibivWpzdZyKHZWUCZ9j,GRACE – Fine Floral Lace & Sheer Mesh Set - Noir,"Şeffaf. Nefes. Biçim. Lüksün en sessiz hâli. Son derece ince çiçek danteli bedende ağırlıksız durur. Balenli balkon kesim dolgusuz, doğal bir yükseliş sunar. Bacak çizgisini uzatan yüksek kesim alt parçayla eşleşir. Saf denge.",in stock,new,71.00 USD,https://mermaidsglance.com/products/gracefineflorallacesheermeshset-noirTHlw,https://assets.lightfunnels.com/account-99158/images_library/6c56e277-2bfc-4b11-8bce-a2c0d55b5094.jpg,MERMAID'S GLANCE,Apparel & Accessories > Clothing > Underwear & Socks > Lingerie
prod_z0tNRArk_NH_XVjqJu3Uw,CAMILLE – Floral Embroidery on Nude Mesh Garter Set - Black,Mürekkep. Ten. Kontrast. Optik illüzyonun ustalık dersi. Görünmez ten rengi tül üzerine elle yerleştirilmiş opak siyah çiçek motifleri. Çarpıcı dövme etkisi. Yüksek belli jartiyer kemeri keskin geometrik çizgiler kullanır. Grafik keskinlikle romantizm.,in stock,new,106.00 USD,https://mermaidsglance.com/products/lembroideryonnudemeshgarterset-blackAFGe,https://assets.lightfunnels.com/account-99158/images_library/8aa49b5d-f55e-4280-8ec9-69cf46eb7f0a.jpg,MERMAID'S GLANCE,Apparel & Accessories > Clothing > Underwear & Socks > Lingerie
prod_EcqiMslEWfATX7acmP4o5,VICTORIA – Faux Leather Cutout High-Leg Bodysuit - Noir,Pürüzsüz. Ten. Güç. Yüksek voltajlı etki. Islak görünümlü pürüzsüz kumaş bedeni ikinci ten gibi biçimlendirir. Cesur merkez halka detayı. Kararlı geometrik kesikler. Yüksek bacak silüeti formu uzatır. Tavizsiz güç.,in stock,new,83.00 USD,https://mermaidsglance.com/products/uxleathercutouthigh-legbodysuit-noir3vhM,https://assets.lightfunnels.com/account-99158/images_library/d2c155aa-ad45-4b39-ace7-4032cff0e8bd.jpg,MERMAID'S GLANCE,Apparel & Accessories > Clothing > Underwear & Socks > Lingerie
prod_Xg1dbuDlLRF8zs6mC7OFZ,TRINITY – Sheer Mesh & Choker Strappy Bodysuit - Noir,Bağ. File. Nabız. Mimari kışkırtma. Bütünleşik gerdanlıklı kavramsal body. Yapılı açık kap kafes tasarımına bağlanır. Şeffaf file gövdeyi şekillendirir. Bütünleşik uyluk jartiyerleri bedeni yaşayan bir heykele dönüştürür.,in stock,new,83.00 USD,https://mermaidsglance.com/products/ysheermeshchokerstrappybodysuit-noirziVu,https://assets.lightfunnels.com/account-99158/images_library/e113210e-9fcc-4149-9fab-0551aceef65d.jpg,MERMAID'S GLANCE,Apparel & Accessories > Clothing > Underwear & Socks > Lingerie
prod_er1broXX1l9O3g7HEho6k,LEONA – Leopard Print & Black Lace Garter Set - Animal,"Vahşi. Av. Altın. Dizginlenemeyen zarafet. Cesur, yüksek kontrastlı leopar deseni incelikli siyah çiçek danteliyle birleşir. Yapılı jartiyer kemeri kalçalar için korse görevi görür. Sofistike koyu konturlar. Odaya hâkim olan kadın için.",in stock,new,106.00 USD,https://mermaidsglance.com/products/eopardprintblacklacegarterset-animalu2A5,https://assets.lightfunnels.com/account-99158/images_library/36b36b5c-556f-46b9-b51c-469e2f254dfb.jpg,MERMAID'S GLANCE,Apparel & Accessories > Clothing > Underwear & Socks > Lingerie
prod_a2o5_KoMkBQ7gvFcx2Tn8,CELESTE – Ruffled Lace & Sheer Mesh Set - Periwinkle,Hava. Mavi. Yumuşak. Keskin bir dokunuşla masumiyet. Nadir deniz salyangozu mavisi tonunda. Oyuncu fırfır biyeli narin çiçek danteli. Ağırlıksız şeffaf file. Saten fiyonk detayları. Ruhani silüete klasik feminen dokunuş.,in stock,new,83.00 USD,https://mermaidsglance.com/products/teruffledlacesheermeshset-periwinklePSFn,https://assets.lightfunnels.com/account-99158/images_library/8a97ee07-3b07-494f-93b9-dc2b4e28e880.jpg,MERMAID'S GLANCE,Apparel & Accessories > Clothing > Underwear & Socks > Lingerie
prod_x714ScjJgDCz7d4IvKI4r,Culotte Alba,"Her kıvrımı zarafetle yükselten rafine dantel Alba alt parçanın inceliğini keşfet. Hafif motif ve dilimli bitişler duyusal, feminen bir silüet çizer. Rahat ve hafif yapısı ikinci ten gibi taşınır, günlük yaşama sofistike bir dokunuş katar. Farklı renklerde sunulan Alba, eksiksiz ve karşı konulmaz bir görünüm için uyumlu üstüyle birleşir.",in stock,new,21.00 USD,https://mermaidsglance.com/products/culottealbaGwpr,https://assets.lightfunnels.com/account-99158/images_library/17513cd9-bb9b-4708-b11e-03c030ba33fd.jpg,MERMAID'S GLANCE,Apparel & Accessories > Clothing > Underwear & Socks > Lingerie
prod_Pk-YVFrVve64soPPk4nzr,Culotte Sabrina,"Zarif ve narin Sabrina alt parça, modern ve rafine yaprak motifli grafik danteliyle ayrışır. Ölçülü şeffaflık kıvrımları yükseltirken gün boyu konfor sağlar. Kusursuz destek sunan klasik kesim ve kıyafet altında kaybolan düz bitişler cazibeyle işlevi birleştirir. Setlerine doğal bir zarafetle eşlik eden vazgeçilmez bir iç giyim parçası.",in stock,new,21.00 USD,https://mermaidsglance.com/products/culottesabrinaDiDz,https://assets.lightfunnels.com/account-99158/images_library/0a73082f-8420-47a7-87e6-91848aae8054.jpg,MERMAID'S GLANCE,Apparel & Accessories > Clothing > Underwear & Socks > Lingerie
prod_YzC87EXtDHNsTxOa43sWl,KIRA – Sketch Floral Embroidery & Strappy Garter Set - Noir,Mürekkep. Çizgi. Biçim. Grafik gerilimin başyapıtı. Cesur mimari askılarla çerçevelenen eskiz stili çiçek işlemesi. Yapılı yükseliş. Jartiyer kemeri dramatik kafes etkisi kurar. Altın donanımla tamamlanır. Endüstriyel lüks.,in stock,new,106.00 USD,https://mermaidsglance.com/products/loralembroiderystrappygarterset-noiroqK1,https://assets.lightfunnels.com/account-99158/images_library/b9d33305-1fab-41e3-a117-f887ceeaddb5.jpg,MERMAID'S GLANCE,Apparel & Accessories > Clothing > Underwear & Socks > Lingerie
prod_mXW543Jtvr5vkUPKxs0SQ,Tanga Liliane,"Cesur zarafete Liliane Tanga ile adım at; kıvrımları yükseltmek için tasarlanmış duyusal bir parça. Rafine çiçek danteli teni şeffaflıkla giydirir, incelikle karakter arasında ölçülü kontrast kurar. Sırtta yükselen tanga kesimi kıvrımları feminenlikle vurgular ve gün boyu karşı konulmaz konfor verir. Özenli bitişler sofistike bir dokunuş katar; setleri tamamlar veya tek başına stil ifadesi olur. Beyaz, siyah ve kırmızı renklerde sunulan Liliane, cazibeyle modernliği birleştiren vazgeçilmezdir.",in stock,new,21.00 USD,https://mermaidsglance.com/products/tangalilianeetaV,https://assets.lightfunnels.com/account-99158/images_library/a5794548-2987-4df5-9c78-94b77dfb219c.jpg,MERMAID'S GLANCE,Apparel & Accessories > Clothing > Underwear & Socks > Lingerie
prod_0K-JXA35xRJKeArk5zo10,String Love,"Zarif ve cesur Love ipli alt parça, narin çiçek danteli ve yanlardaki ışıltılı LOVE mücevheriyle kıvrımları yükseltir. Duyusallıkla inceliği birleştiren, bakışları toplayan bir parça. Minimalist kesim silüeti cesurca vurgular; parlak detaylar karşı konulmaz bir ihtişam katar. Bakım: Mücevherin ışıltısını korumak için elde yıkama önerilir.",in stock,new,21.00 USD,https://mermaidsglance.com/products/stringloveb4K7,https://assets.lightfunnels.com/account-99158/images_library/bb83cc5c-be25-4961-af78-b6df63c04c9c.jpg,MERMAID'S GLANCE,Apparel & Accessories > Clothing > Underwear & Socks > Lingerie
prod_Fpe_kxnktatXqjfOm9jP_,Culotte Ariana,"Narin Ariana alt parçayı keşfet; konforla cazibeyi birleştirir. Rafine çiçek danteli şeffaflıkla açılır, kıvrımları zarafetle yükseltir. Saten bitişler ve beldeki küçük fiyonk feminen, sofistike bir dokunuş katar. Hem duyusal hem günlük taşımaya rahat Ariana her anı özgüven ve cazibeye dönüştüren vazgeçilmez bir iç giyim parçasıdır.",in stock,new,21.00 USD,https://mermaidsglance.com/products/culotteariana9yJC,https://assets.lightfunnels.com/account-99158/images_library/5164114b-9042-4357-98ef-f0e9f886d865.jpg,MERMAID'S GLANCE,Apparel & Accessories > Clothing > Underwear & Socks > Lingerie
prod_9lupc_COYm_EhUAlzUcAD,VALERIE – Contrast Fan Embroidery Garter Set - Black & Beige,Eskiz. Kontrast. Sanat. İllüstrasyon gibi iç giyim. Görünmez bej tül üzerine çizilmiş belirgin siyah yelpaze motifli işlemeler. Çarpıcı bir süzülme etkisi. Yüksek kontrastlı biyeler formu tanımlar. Bedeni yaşayan bir tuvale dönüştürür.,in stock,new,83.00 USD,https://mermaidsglance.com/products/astfanembroiderygarterset-blackbeigeW5w1,https://assets.lightfunnels.com/account-99158/images_library/59d94e8c-9815-4b4a-ae6e-c5a85ae87e69.jpg,MERMAID'S GLANCE,Apparel & Accessories > Clothing > Underwear & Socks > Lingerie
prod_KcY-d-riNUKxsKTDF1Le3,Culotte Rosetta,"Zarif ve narin Rosetta alt parça, rafine çiçek danteliyle kendini gösterir. Şeffaflık oyunu kıvrımları incelikle vurgularken yumuşak ve rahat kesim silüete kusursuzca oturur. Cazibeyle rahatlığı birleştirmek için tasarlandı; günlük yaşamda da daha özel anlarda da taşınabilir. Farklı ruh hâllerine uyum sağlayan renk seçenekleriyle feminen bir vazgeçilmez.",in stock,new,21.00 USD,https://mermaidsglance.com/products/culotterosettaMGg1,https://assets.lightfunnels.com/account-99158/images_library/59a91d0d-657d-4fa9-baf3-776b61f468db.jpg,MERMAID'S GLANCE,Apparel & Accessories > Clothing > Underwear & Socks > Lingerie
prod_MCxZo6EAOdLghRV0fW6IH,MARGOT – Swiss Dot Mesh & Satin Garter Set - Noir,"Puantiye. Nostalji. Şeffaf. Keskinleştirilmiş zamansız nostalji. Yapılı saten panellerle sabitlenen oyuncu siyah puantiyeli file. Önde çapraz jartiyer kemeri grafik, modern bir dokunuş katar. Nostaljik cazibeyle çağdaş keskinliği dengeler.",in stock,new,106.00 USD,https://mermaidsglance.com/products/argotswissdotmeshsatingarterset-noir9Nhe,https://assets.lightfunnels.com/account-99158/images_library/9986372f-7b23-4510-a3ad-df606ef95b4a.jpg,MERMAID'S GLANCE,Apparel & Accessories > Clothing > Underwear & Socks > Lingerie
prod_oouMsKfr18ZXi8cQFas7O,SAPPHIRE – Lace Garter Set with Choker - Midnight Blue,"Gece Yarısı. Bağ. Derin. Derin indigonun incelemesi. Yasmin, üst yapısına bağlanan uyumlu gerdanlık aksesuarıyla zengin gece mavisi dantelde hayat bulur. Jartiyer kemeri kalçaları saten askılarla çerçeveler; geleneksel siyahtan ayrılan bütünlüklü, hâkim bir görünüm kurar.",in stock,new,79.00 USD,https://mermaidsglance.com/products/lacegartersetwithchoker-midnightblueSbFU,https://assets.lightfunnels.com/account-99158/images_library/23f14589-c86d-40ce-a8f6-ebaa9ef3dc25.jpg,MERMAID'S GLANCE,Apparel & Accessories > Clothing > Underwear & Socks > Lingerie
prod_gq1WS3dJQq27Zg3e7P8No,Nuisette Amaya,"Geceleri ve dinlenme anlarını yükseltmek için tasarlanmış zarif ve rahat gecelik. Yumuşak, esnek kumaş bedeni sarar; ayarlanabilir ince askılar kusursuz destek sağlar. Dekolte ve etek ucundaki narin dantel rafine, feminen bir dokunuş katar. Siyah, pudra pembe, desenli beyaz ve çiçekli siyah renklerde sunulur. Bileşim: Yüzde 76 naylon, yüzde 24 elastan.",in stock,new,59.00 USD,https://mermaidsglance.com/products/nuisetteamayaV4bj,https://assets.lightfunnels.com/account-99158/images_library/d2c76b45-77c5-436d-ab1b-ea5f026f259d.jpg,MERMAID'S GLANCE,Apparel & Accessories > Clothing > Underwear & Socks > Lingerie
prod_IoK8BuRkKD2hPfIKndrOQ,CAMILA – Floral Lace & Soft Modal Chemise - Noir,"Yumuşak. Drapeli. Gece. Geçiş parçası. Yapılı çiçek dantelli gövde, akışkan ve son derece yumuşak modal etekle buluşur. Şeffaf bel paneli beli sezdirir. İç giyimin görsel inceliği, lüks ev giyiminin konforu. Kısıtlamasız.",in stock,new,83.00 USD,https://mermaidsglance.com/products/amilaflorallacesoftmodalchemise-noirZdLX,https://assets.lightfunnels.com/account-99158/images_library/d3c96772-9f0a-4525-9792-c1c68441c461.jpg,MERMAID'S GLANCE,Apparel & Accessories > Clothing > Underwear & Socks > Lingerie
prod_DwRW9qRIxJIvODaHBV8rn,String Myra,"Çiçek dantelli duyusal ipli alt parça, kusursuz ve kişisel kalıp için tamamen ayarlanabilir askılara sahiptir. Öndeki mücevher detayı ihtişam katar; minimalist kesim kıvrımları vurgular ve tam kararında gösterir. Hafif, rahat ve cesur. Siyah, beyaz ve mor renklerde sunulur.",in stock,new,21.00 USD,https://mermaidsglance.com/products/stringmyranH1g,https://assets.lightfunnels.com/account-99158/images_library/6588ab73-e1ea-43f5-80df-4017acee2634.jpg,MERMAID'S GLANCE,Apparel & Accessories > Clothing > Underwear & Socks > Lingerie
prod_au1GNMrrxxYBPsLXW4n35,MONICA – Vertical Floral Embroidery & Sheer Lingerie Set- Noir,"Dikey. Biçim. Mürekkep. Silüeti uzatmak için tasarlandı. Şeffaf file üzerinde yükselen çiçek işlemelerinden merkezi bir sütun. Güçlü bir dikey çizgi yaratır. Yüksek bacak kesimi. Açık, askılı sırt. Tende heykelsi, dövme benzeri bir bitiş.",in stock,new,79.00 USD,https://mermaidsglance.com/products/loralembroiderysheerlingerieset-noirO7Du,https://assets.lightfunnels.com/account-99158/images_library/dcf68cc9-c468-4e1e-9c85-ffe37bef3e62.jpg,MERMAID'S GLANCE,Apparel & Accessories > Clothing > Underwear & Socks > Lingerie
prod_cBXnsLi2CPKii733PtqxO,RAQUEL – Floral Lace & Cutout Mesh Bodysuit - Noir,Şeffaf. Biçim. İkon. Dantel imza silüetimizin yeniden tasarlanmış hâli. Yapılı çiçek işlemesi stratejik şeffaf fileyle buluşur. Beli ikinci ten gibi şekillendirir. Balen desteği. Bacak çizgisini uzatan yüksek kesim kalçalar. İddialı parça.,in stock,new,65.00 USD,https://mermaidsglance.com/products/uelflorallacecutoutmeshbodysuit-noirUmd7,https://assets.lightfunnels.com/account-99158/images_library/8fe0bbe0-18d8-4124-80a7-c4141474dbdd.jpg,MERMAID'S GLANCE,Apparel & Accessories > Clothing > Underwear & Socks > Lingerie
prod_LbsCU0vHvJyHo9JqKlQRS,String Lina,"Yüksek kesimi narin çapraz bantlarla birleştirerek kalçaları öne çıkaran çekici bir ipli alt parça. Çiçek danteli zarif ve duyusal bir dokunuş getirirken çift askılar ve merkez halka cesur, modern bir vurgu katar. Siyah, beyaz ve kırmızı renklerde sunulur.",in stock,new,21.00 USD,https://mermaidsglance.com/products/stringlinacrQU,https://assets.lightfunnels.com/account-99158/images_library/72997014-946a-4b9a-801f-4e9190dffb23.jpg,MERMAID'S GLANCE,Apparel & Accessories > Clothing > Underwear & Socks > Lingerie
prod_Qkety62h9uu9HjU-06Z4u,String Alba,"Şeffaflıkla oynamak için tasarlanmış duyusal ve minimalist ipli alt parça. Tül ön yüz narin çiçek danteli ve küçük saten fiyonkla süslüdür; ipli sırt kıvrımları vurgular ve kıyafet altında iz bırakmaz. Hafif, sade ve cesur. Siyah, beyaz ve kırmızı renklerde sunulur.",in stock,new,21.00 USD,https://mermaidsglance.com/products/stringalbaKVh_,https://assets.lightfunnels.com/account-99158/images_library/fec2aacd-d9a2-4290-97b1-1d991266246a.jpg,MERMAID'S GLANCE,Apparel & Accessories > Clothing > Underwear & Socks > Lingerie
prod_9-0eVz0fTceFPmjcDLNOw,ELISE – Ruffled Lace & Sheer Bralette Set - White,"Fırfır. Hava. Yumuşak. Narin dokuların incelemesi. Üçgen kapları çerçeveleyen romantik fırfır kenarlı, fısıltı inceliğinde beyaz dantel. Uyumlu ipli alt parça aynı fırfır detayını tekrarlar. Oyuncu ama rafine. Kişisel kalıp için ayarlanabilir askılar.",in stock,new,83.00 USD,https://mermaidsglance.com/products/iseruffledlacesheerbraletteset-whitem1u_,https://assets.lightfunnels.com/account-99158/images_library/28d1170e-5ce9-4753-9089-1b19b54eba11.jpg,MERMAID'S GLANCE,Apparel & Accessories > Clothing > Underwear & Socks > Lingerie
prod_9EFqTLRQG60rfI0Bb6PUu,Tanga Isla,"Konforla duyusallığı birleştiren zarif tanga. Yumuşak mikrofiber ön yüz tene otururken şeffaf çiçek dantelli yanlar rafine bir dokunuş katar. Yüksek kesimli sırt ve narin detay cazibeyi sürdürür. Pudra pembe, lila ve siyah renklerde sunulur.",in stock,new,21.00 USD,https://mermaidsglance.com/products/tangaislayCQz,https://assets.lightfunnels.com/account-99158/images_library/430a961f-da1a-4936-ae54-e7f8fc27b253.jpg,MERMAID'S GLANCE,Apparel & Accessories > Clothing > Underwear & Socks > Lingerie
prod_mIKKynSZ8wiPQgC0RtJ4d,Culotte Liora,"Konforla zarafeti buluşturan yumuşak ve feminen alt parça. Orta yüksek kesim silüeti öne çıkarır; dantel kenarlar ve beldeki küçük fiyonk rafine bir dokunuş katar. Yumuşak, esnek kumaş stilden ödün vermeden gün boyu rahatlık sağlar. Su yeşili, beyaz ve siyah renklerde sunulur.",in stock,new,21.00 USD,https://mermaidsglance.com/products/culotteliorangO9,https://assets.lightfunnels.com/account-99158/images_library/9a2a2563-c51f-4d07-a04f-3ca15b0c03e9.jpg,MERMAID'S GLANCE,Apparel & Accessories > Clothing > Underwear & Socks > Lingerie
prod_a922qrBTj03IzFe41hRI1,String Nyla,"Esnek ipli yanlara sahip son derece minimal fitilli alt parça. Yumuşak ve esnek doku, ikinci ten etkisi. Düşük belli kesim silüeti uzatır; sade ipli sırt kıyafet altında kaybolur. Günlük taşımak veya düşük belli jean altında kullanmak için kusursuz.",in stock,new,21.00 USD,https://mermaidsglance.com/products/stringnylar2C2,https://assets.lightfunnels.com/account-99158/images_library/bdee502c-143c-4412-a145-5de60545d2d5.jpg,MERMAID'S GLANCE,Apparel & Accessories > Clothing > Underwear & Socks > Lingerie
prod_PEtG7JbXB3RXwYV6LsUF4,String Nudae,"Özel ön astarıyla tasarlanmış görünmez, yüksek belli ipli alt parça. Yumuşak, toparlayıcı ve son derece esnek doku kıvrımları iz bırakmadan dengeler. Tayt veya bedeni saran elbiselerin altında kusursuz. Ten ve siyah renklerde sunulur.",in stock,new,21.00 USD,https://mermaidsglance.com/products/stringnudaeJnuF,https://assets.lightfunnels.com/account-99158/images_library/ee9b7470-73fb-4bd1-9469-10df0aef4bdb.jpg,MERMAID'S GLANCE,Apparel & Accessories > Clothing > Underwear & Socks > Lingerie
prod_wqsvwIiQiD5jeoRvAgGk-,Soutien-gorge Nola,"Kıyafet altında görünmez olmak için tasarlanan bu pürüzsüz mikrofiber üst, göğüs hattını dengeler ve esnek, rahat destek sunar. Dikişsiz kalıplı kaplar doğal biçim verir; önden kapama kolay ve hızlı kullanım sağlar. Yumuşak ve esnek dokusu yüzde 85 naylon, yüzde 15 elastan bileşimiyle bedeni ikinci ten gibi sarar. İpeksi dokunuş, yüksek esneklik ve bedeni saran kıyafetlerin altında görünmez etki. Siyah, açık ten, koyu ten ve moka renklerinde sunulur.",in stock,new,21.00 USD,https://mermaidsglance.com/products/soutien-gorgenolaBoXH,https://assets.lightfunnels.com/account-99158/images_library/443ff534-e08b-48aa-b72d-e69dcaa0c3de.jpg,MERMAID'S GLANCE,Apparel & Accessories > Clothing > Underwear & Socks > Lingerie
prod_ll6eSx4JH9zLLMKds_WmB,String Gleam,"Görünmezlikle mücevher etkisini birleştiren altın halkalı minimalist ipli alt parça. Uzatılmış merkez bandı özel bölgeyi pürüzsüzleştirir ve izleri önler. Yumuşak, esnek doku ve ipli sırt bedeni saran kıyafetlerin altında kusursuzdur. Siyah, ten ve moka renklerde sunulur.",in stock,new,21.00 USD,https://mermaidsglance.com/products/stringgleamK6uQ,https://assets.lightfunnels.com/account-99158/images_library/8faec3ef-c6cf-4714-baac-69d9d9fbdc3d.jpg,MERMAID'S GLANCE,Apparel & Accessories > Clothing > Underwear & Socks > Lingerie
prod_TIKD6c_NEFs0Hcasj2WwA,String Maela,"Yumuşak mikrofiberden sade ipli alt parça, çift ayarlanabilir askılarıyla kalçaları öne çıkarmak için tasarlandı. Sırttaki altın kalp mücevher bel kıvrımını duyusallıkla vurgular. İpli kesim, ikinci ten etkisi; siyah, beyaz ve pudra pembe renklerde sunulur.",in stock,new,21.00 USD,https://mermaidsglance.com/products/stringmaelavzBM,https://assets.lightfunnels.com/account-99158/images_library/02d594ed-0ff3-41cc-845a-50c10f6ab145.jpg,MERMAID'S GLANCE,Apparel & Accessories > Clothing > Underwear & Socks > Lingerie
prod_3C1hEGPgIkFe9wy6vX7eh,LAYLA – Lace & Modal Soft Chemise - Noir,"Siyah. Yumuşak. Gece. Modern gece için zahmetsiz zarafet. Balen destekli narin şeffaf dantel gövde. Etek son derece yumuşak, akışkan modal kumaştan işlendi. İç giyimin görsel inceliğiyle ev giyiminin konforunu dengeler.",in stock,new,83.00 USD,https://mermaidsglance.com/products/laylalacemodalsoftchemise-noirvJ6D,https://assets.lightfunnels.com/account-99158/images_library/fbfda3ad-4df2-4e12-b8c2-1db0d810face.jpg,MERMAID'S GLANCE,Apparel & Accessories > Clothing > Underwear & Socks > Lingerie
prod_BWtMKxvyX4IAev95MuONw,MIA – Stripe Satin Short Pajama Set - Pink,İpek. Çizgiler. Rahatlık. Parlak dinlenme anının tanımı. Klasik dikey çizgili akışkan satenden biçimlendirildi. Kontrast biyeli düğmeli yakalı gömlek. Uyumlu şort. Sabah rutinini kendine saygı ritüeline yükseltir.,in stock,new,71.00 USD,https://mermaidsglance.com/products/miastripesatinshortpajamaset-pink-rbD,https://assets.lightfunnels.com/account-99158/images_library/d3c8da7f-436a-4049-93f3-81f3cf0869f3.webp,MERMAID'S GLANCE,Apparel & Accessories > Clothing > Underwear & Socks > Lingerie
prod_inyx_mca_YpflCocYrAAk,LUCIA – Full Lace & Sheer Panel Mini Slip - Red,Dantel. Ten. Nabız. Dokulu çiçek dantelinden incelikle işlendi. Bedeni yakından izleyen kalıp. Dikey şeffaf paneller gövdeyi uzatır. Sırtta grafik askı detayı. İç giyim yapısıyla slip elbise rahatlığının birleşimi.,in stock,new,83.00 USD,https://mermaidsglance.com/products/luciafulllacesheerpanelminislip-redqyng,https://assets.lightfunnels.com/account-99158/images_library/e571e201-e6b7-40a2-b60d-7172e54fc5ae.jpg,MERMAID'S GLANCE,Apparel & Accessories > Clothing > Underwear & Socks > Lingerie
prod_yHgP9fSMBDv5d9iLNw-wl,ARIA – Sheer Mesh & Lace Slit Chemise - Rouge,"Akış. Şeffaf. Ateş. Kapı kapandığı an için tasarlandı. Yapılı çiçek dantelli gövde, aşağı akan şeffaf fileyle buluşur. Cesur yan yırtmaç silüeti keser. Tavizsiz keskinlikle hareket. Kızıl bir ifade.",in stock,new,83.00 USD,https://mermaidsglance.com/products/ariasheermeshlaceslitchemise-rougeoXYE,https://assets.lightfunnels.com/account-99158/images_library/09efbdbe-77d3-431a-85a8-27d7dd81a494.jpg,MERMAID'S GLANCE,Apparel & Accessories > Clothing > Underwear & Socks > Lingerie
prod_eOFuh6t3bODXmNeC6iNqZ,String Velora,"Kelebek esintili motiflerle süslü, son derece ince işlemeli tül ipli alt parça. Hafif, grafik ve neredeyse hissedilmez; iz bırakmadan kıvrımları yükseltir. Kıyafet altında görünmez. Siyah, bordo ve altın ten renklerinde sunulur.",in stock,new,21.00 USD,https://mermaidsglance.com/products/stringvelorakE8_,https://assets.lightfunnels.com/account-99158/images_library/6f289d66-edd1-4bb3-866f-1384c21d5003.jpg,MERMAID'S GLANCE,Apparel & Accessories > Clothing > Underwear & Socks > Lingerie
