id,title,description,availability,condition,price,link,image_link,brand,google_product_category
prod_G0WOOFqChTikhpnYDFk-v,AMY – Sheer Heart Print Maxi Dress - Noir,Romantizm. Tül. Ritim. Romantizm tende dans eder. Şeffaf siyah file üzerinde mini kalp desenleri. Yere uzanan silüet. Aşkın ve cesaretin ritmi. Sevimlilik değil; romantizmi yaşamak. İçinde: Şeffaf kalp desenli maksi elbise.,in stock,new,62.00 USD,https://mermaidsglance.com/products/amysheerheartprintmaxidress-noir3m1s,https://assets.lightfunnels.com/account-99158/images_library/f228b37c-9036-4ab4-af15-e3fd2f868e89.jpg,MERMAID'S GLANCE,Apparel & Accessories > Clothing > Underwear & Socks > Lingerie
prod_hVBB-ki35oafUIyrhA6xG,RAY – Crystal-Embellished Halter Lingerie Set - Noir,"Keskin. Parıltı. Üçlü. Keskin bir çizgiyle parla. Kristal taşlı boyundan bağlı üst ışığı yakalar. Dantel detaylı jartiyer kemeri parıltıyı bir silaha dönüştürür. Aydınlık değil; keskin bir güzellik. İçinde: Kristal boyundan bağlı üst, jartiyer kemeri ve dantel çoraplar.",in stock,new,55.00 USD,https://mermaidsglance.com/products/al-embellishedhalterlingerieset-noirgrSO,https://assets.lightfunnels.com/account-99158/images_library/136ceb82-751d-488f-a42f-9a17ec67d218.png,MERMAID'S GLANCE,Apparel & Accessories > Clothing > Underwear & Socks > Lingerie
prod_dOpmeZv-2WxpNSi-WtA8W,SHAY – Noir Floral Lace & Mesh Bodystocking - Noir,"div]:bg-bg-000/50 [&_pre>div]:border-0.5 [&_pre>div]:border-border-400 [&_.ignore-pre-bg>div]:bg-transparent [&_.standard-markdown_:is(p,blockquote,h1,h2,h3,h4,h5,h6)]:pl-2 [&_.standard-markdown_:is(p,blockquote,ul,ol,h1,h2,h3,h4,h5,h6)]:pr-8 [&_.progressive-markdown_:is(p,blockquote,h1,h2,h3,h4,h5,h6)]:pl-2 [&_.progressive-markdown_:is(p,blockquote,ul,ol,h1,h2,h3,h4,h5,h6)]:pr-8""> _*]:min-w-0 standard-markdown""> Tuval. Mürekkep. Bütün. Bir tuvale dönüş. İncelikli siyah çiçek danteli bedeni sarar. Boyundan ayak ucuna yaşayan sanat. Desen her hareketle nefes alır. Sanatın kendisi ol. İçinde: Tüm bedeni saran çiçek dantelli body çorabı.",in stock,new,55.00 USD,https://mermaidsglance.com/products/ynoirflorallacemeshbodystocking-noirwPCn,https://assets.lightfunnels.com/account-99158/images_library/70ea5538-da45-4e2d-a5bb-c7695af7d18a.png,MERMAID'S GLANCE,Apparel & Accessories > Clothing > Underwear & Socks > Lingerie
prod_jUo49qLgbXp59DUuEItHx,NANA – Contrast Ruffled Mesh Maid Costume - Noir,"Tiyatro. Kontrast. Oyun. Bir tiyatro gibi kostümler. Oyuncu fırfırlarla çerçevelenen dramatik siyah beyaz kontrast. Her parça oyunun için bir sahne aracı. Hizmet etmek değil; sahneye hükmetmek. İçinde: Fırfırlı file üst, yüksek belli şort, gerdanlık ve uzun eldivenler.",in stock,new,55.00 USD,https://mermaidsglance.com/products/acontrastruffledmeshmaidcostume-noirj605,https://assets.lightfunnels.com/account-99158/images_library/1afb2056-12e1-44d7-a95d-a685eac1348f.jpg,MERMAID'S GLANCE,Apparel & Accessories > Clothing > Underwear & Socks > Lingerie
prod_Dssbj6kQ5xQ9FB4OIIaKx,JOY – White Embroidery Lace-Up Corset Set - White,"Çiçek. Bağ. Masum. Masum görün, cesur hisset. Beyaz çiçek dantelli bağcıklı korse beli tanımlar. Fiyonklar ve fırfırlı bacak bantlarıyla vurgulanır. Saflıkla değil; masumiyetin içindeki cesaretle ilgili. İçinde: Bağcıklı işlemeli korse, jartiyer kemeri ve fırfırlı bacak bantları.",in stock,new,62.00 USD,https://mermaidsglance.com/products/hiteembroiderylace-upcorsetset-whiteJr8U,https://assets.lightfunnels.com/account-99158/images_library/0ba127cb-0d9a-488d-8294-3858d79247bc.jpg,MERMAID'S GLANCE,Apparel & Accessories > Clothing > Underwear & Socks > Lingerie
prod_A3YpAsw6rx2eVaSE6QffY,TINA – Fringed Bandeau & Mesh Glove Garter Set - Noir,"Ritim. Akış. Hareket. İçinde dans edilen setler. Akışkan siyah püsküller her ritimle hareket eder. File eldivenler ve metal tokalı gerdanlık. Hiç durmayan dinamik enerji. Solmak yerine ak. İçinde: Püsküllü bandeau üst, jartiyer kemeri, file eldivenler ve uyumlu alt parça.",in stock,new,62.00 USD,https://mermaidsglance.com/products/ringedbandeaumeshglovegarterset-noirZ84O,https://assets.lightfunnels.com/account-99158/images_library/b4830b5d-8f8f-414a-8470-9098a9e585fd.jpg,MERMAID'S GLANCE,Apparel & Accessories > Clothing > Underwear & Socks > Lingerie
prod_RAWY7pOX3ul-YPbSlSHF1,KATE – Glossy Faux Leather & Chain-Link Bodysuit - Noir,"Senaryo. Bağ. Kontrol. Senaryoyu değiştir. Parlak siyah suni deri odaya hâkim olur. Metal zincirlerle bilek manşetlerine bağlanan gerdanlık. Kendi sahneni yaz. Kontrol bir sanat biçimidir. İçinde: Bütünleşik gerdanlık, zincir ve manşetli suni deri body.",in stock,new,59.00 USD,https://mermaidsglance.com/products/syfauxleatherchain-linkbodysuit-noirdi5n,https://assets.lightfunnels.com/account-99158/images_library/a12cee89-9a42-48ec-949e-c2bca13be31b.jpg,MERMAID'S GLANCE,Apparel & Accessories > Clothing > Underwear & Socks > Lingerie
prod_qnvOy5IvwZ96mEhMPAkDl,MAIA – Floral Embroidery Ruffled Corset Set - Blush,"Çiçeklen. Biçim. Sanat. Birer sanat eseri olan setler. Çiçek işlemesiyle süslü pudra pembe şeffaf dantel. Fırfırlı kenarlar ve yapılı korse beli çerçeveler. Yumuşak değil; gücün içinde yaşayan romantizm. İçinde: İşlemeli korse, fırfırlı bacak bantları ve uyumlu alt parça.",in stock,new,62.00 USD,https://mermaidsglance.com/products/oralembroideryruffledcorsetset-blushGjjr,https://assets.lightfunnels.com/account-99158/images_library/57b8fe72-f473-4745-b549-5f4b4e1ca13c.jpg,MERMAID'S GLANCE,Apparel & Accessories > Clothing > Underwear & Socks > Lingerie
prod_5i4YClldTwsqIG3VFbVsq,HOPE – Bridal-Inspired White Lace Garter Set - White,"Canlılık. Zarafet. Öz. Özel anları bekleme. Romantik fiyonklarla çerçevelenen şeffaf beyaz dantel. Narin jartiyer kemeri. Her gün gelin gibi hisset. Saf zarafetin dışa yansıması. İçinde: Balenli dantel üst, jartiyer kemeri ve uyumlu alt parça.",in stock,new,59.00 USD,https://mermaidsglance.com/products/dal-inspiredwhitelacegarterset-whiteEvtd,https://assets.lightfunnels.com/account-99158/images_library/648ff3bb-188d-460c-b95e-98a2ddd4aafc.jpg,MERMAID'S GLANCE,Apparel & Accessories > Clothing > Underwear & Socks > Lingerie
prod_Zha0v3EMi7XfdAhC3pRbR,DOVE – White Lace & Diamond Fishnet Bodystocking - White,Saflık. Cesaret. Çerçeve. Beyazı yeniden tanımla. Narin beyaz dantel cesur elmas gözlü fileyle birleşir. Bedeni bir sanat eseri gibi çerçeveler. Saf olmakla değil; saflığın içinde cesur olmakla ilgili. Sakin güç. İçinde: Beyaz dantel ve file body çorabı.,in stock,new,55.00 USD,https://mermaidsglance.com/products/lacediamondfishnetbodystocking-white_7Pg,https://assets.lightfunnels.com/account-99158/images_library/bf368afa-361a-4a82-9ac5-a23f0c6cb4e5.jpg,MERMAID'S GLANCE,Apparel & Accessories > Clothing > Underwear & Socks > Lingerie
prod_fSzfLYNcMVwzeTr5YEm02,DELTA – Officer-Inspired Roleplay Costume Set - Navy,"Otorite. Kural. Mantık. Kuralları yaz. Otoriteyi oyuncu lacivert bir estetikle yeniden yorumlar. Önden bağlanan kısa üst ve fırfırlı mini etek. Kontrollü, profesyonel enerji. Kendi anlatına komuta et. İçinde: Subay stili kısa üst, fırfırlı etek ve temalı aksesuarlar.",in stock,new,55.00 USD,https://mermaidsglance.com/products/icer-inspiredroleplaycostumeset-navyi0gA,https://assets.lightfunnels.com/account-99158/images_library/cca5275e-8073-450a-b5ba-aa2d5f3863ff.png,MERMAID'S GLANCE,Apparel & Accessories > Clothing > Underwear & Socks > Lingerie
prod_b9R-cALCzjwWmQR6YVzBw,NEVE – Geometric Halter-Neck Fishnet Bodystocking - Noir,"Minimal. Etki. Strateji. En azını göstererek en çoğunu söyle. Stratejik file dokusu bedeni sarar. Boyundan bağlı çizgi ve metal halkalarla çerçevelenen derin yan kesikler. En yüksek etki. Güç kesinlikte. İçinde: Metal halkalı, boyundan bağlı file body çorabı.",in stock,new,55.00 USD,https://mermaidsglance.com/products/chalter-neckfishnetbodystocking-noirlAxO,https://assets.lightfunnels.com/account-99158/images_library/6dc89613-7035-4fb9-91ea-3b1c4272186f.webp,MERMAID'S GLANCE,Apparel & Accessories > Clothing > Underwear & Socks > Lingerie
prod_kO-VKkcKcBN1S-TTDh-3B,GALA – Crystal-Embellished Lace-Up Mini Dress - Noir,Parıltı. Geometri. Sanat. Seni dönüştüren elbiseler. Geometrik bağcık mimarisi üzerinde ışığı yakalayan kristaller. Her boşluk hesaplı. Her bağ bir ifade. Silüet her şeyi söyler. İçinde: Kristal süslemeli bağcıklı mini elbise.,in stock,new,58.00 USD,https://mermaidsglance.com/products/tal-embellishedlace-upminidress-noirdMMb,https://assets.lightfunnels.com/account-99158/images_library/426fb779-4ce7-4ac3-be93-1f4defd3b86f.png,MERMAID'S GLANCE,Apparel & Accessories > Clothing > Underwear & Socks > Lingerie
prod_qyuADKDUnAZUBDnSahjba,PIXIE – Heart-Embellished Playful Set - Pink,Kalp. Oyun. Tutku. Oyunculuk kalpte yaşar. Ciddiyeti reddeden geceler için tasarlandı. Pembe kalp detaylarıyla süslü. Cesur bir dokunuş katar. Romantizm değil; oyuncu enerji. İçinde: Kalp süslemeli üst ve uyumlu ipli alt parça.,in stock,new,58.00 USD,https://mermaidsglance.com/products/ixieheart-embellishedplayfulset-pink_knl,https://assets.lightfunnels.com/account-99158/images_library/606b9646-88f8-4317-9033-343cd38ae4a5.webp,MERMAID'S GLANCE,Apparel & Accessories > Clothing > Underwear & Socks > Lingerie
prod_Az30HUjaCLLSXtI_t6_vO,STARR – Crystal-Embellished Mesh Bodysuit & Gloves - Noir,"Parıltı. Gece. Keşif. Yıldızlı geceyi tenine taşı. Şeffaf siyah file üzerinde parlayan kristaller. Her harekette ışığı yakala. Uzun file eldivenler kolları dönüştürür. Gecenin kendisi ol. İçinde: V yakalı kristal body, uyumlu jartiyer askıları ve uzun kristal eldivenler.",in stock,new,62.00 USD,https://mermaidsglance.com/products/l-embellishedmeshbodysuitgloves-noirSfwu,https://assets.lightfunnels.com/account-99158/images_library/319a7814-c367-409a-a97a-2da446f5dd96.png,MERMAID'S GLANCE,Apparel & Accessories > Clothing > Underwear & Socks > Lingerie
prod__IR7QxfrO6RYf2_3YsNMo,DORA – Baroque Floral Embroidery Garter Set - Noir,"Zanaat. Barok. Sanat. Zanaata dönüşen setler. Şeffaf file üzerinde incelikli barok çiçek işlemesi. Yüksek belli jartiyer kemeri beli vurgular. Süslemekle değil; sanat olmakla ilgili. İçinde: İşlemeli üst, barok jartiyer kemeri ve uyumlu alt parça.",in stock,new,61.00 USD,https://mermaidsglance.com/products/aroquefloralembroiderygarterset-noirbde_,https://assets.lightfunnels.com/account-99158/images_library/567665d4-a03d-4ef3-88c3-816516d5babe.jpg,MERMAID'S GLANCE,Apparel & Accessories > Clothing > Underwear & Socks > Lingerie
prod_dlQyEcHvGtZuOOp58q7Nf,IONA – Asymmetric Oval-Patterned Bodystocking - Noir,Asimetri. Kural. Nefes. Kuralları yeniden çiz. Asimetrik tek omuz tasarım beklentileri bozar. Büyük oval desenli file teni tuvale dönüştürür. Her boşluk bir ifade. Kendi dengeni kur. İçinde: Asimetrik tek omuzlu body çorabı.,in stock,new,55.00 USD,https://mermaidsglance.com/products/etricoval-patternedbodystocking-noirDIxT,https://assets.lightfunnels.com/account-99158/images_library/8b2bb9b8-b493-4271-b56f-ea47c8989c2f.webp,MERMAID'S GLANCE,Apparel & Accessories > Clothing > Underwear & Socks > Lingerie
prod_r5jUsbOM4JVmPu0K2dOIU,VESTA – Architectural Harness & Mesh Bodysuit - Noir,Geometri. Mantık. Yapı. Mimariye dönüşen parçalar. Opak siyah kaplar destekler ve çerçeveler. Çapraz askılar geometri kurar. Metal donanım bedeni sanata dönüştürür. Her çizgi bilinçli. İçinde: File panelli balenli harness body.,in stock,new,55.00 USD,https://mermaidsglance.com/products/rchitecturalharnessmeshbodysuit-noirVOPG,https://assets.lightfunnels.com/account-99158/images_library/832fd57f-27ae-49fe-8e07-023793fdf502.jpg,MERMAID'S GLANCE,Apparel & Accessories > Clothing > Underwear & Socks > Lingerie
prod_XeY978cGs11c7n-fQnMr7,ZADE – Fearless Noir Impact Lingerie Set - Noir,"div]:bg-bg-000/50 [&_pre>div]:border-0.5 [&_pre>div]:border-border-400 [&_.ignore-pre-bg>div]:bg-transparent [&_.standard-markdown_:is(p,blockquote,h1,h2,h3,h4,h5,h6)]:pl-2 [&_.standard-markdown_:is(p,blockquote,ul,ol,h1,h2,h3,h4,h5,h6)]:pr-8 [&_.progressive-markdown_:is(p,blockquote,h1,h2,h3,h4,h5,h6)]:pl-2 [&_.progressive-markdown_:is(p,blockquote,ul,ol,h1,h2,h3,h4,h5,h6)]:pr-8""> _*]:min-w-0 standard-markdown""> Korkusuz. İfade. Sarsılmaz. Bazı geceler cesaret ister. Çarpıcı derin siyahta hayat bulur. Sarsılmaz hissettirir. İddianı ortaya koy. Cesur yanını benimse. Sınır tanımayan güç. İçinde: Balenli siyah üst ve uyumlu ipli alt parça.",in stock,new,62.00 USD,https://mermaidsglance.com/products/defearlessnoirimpactlingerieset-noirrfby,https://assets.lightfunnels.com/account-99158/images_library/5ac5dcf2-d5bc-4031-9181-ae946762333a.jpg,MERMAID'S GLANCE,Apparel & Accessories > Clothing > Underwear & Socks > Lingerie
prod_KBvugsl6brEonXl-v90oJ,VENUS – Faux Leather Python Print Predatory Set - Snake,Tehlike. Zarafet. Av. Tehlike zarafetle dans eder. Baştan çıkarıcı yılan deseniyle güçlenen pürüzsüz siyah suni deri. İçindeki yırtıcıyı benimse. Cesur olmakla değil; tehlikeli olmakla ilgili. Ham güç. İçinde: Yılan desenli suni deri üst ve uyumlu alt parça.,in stock,new,62.00 USD,https://mermaidsglance.com/products/leatherpythonprintpredatoryset-snakebcK5,https://assets.lightfunnels.com/account-99158/images_library/b46eea25-7108-4858-867a-7d33bb9bec62.jpg,MERMAID'S GLANCE,Apparel & Accessories > Clothing > Underwear & Socks > Lingerie
prod_QC54QHIq9Kad_PHUjHwXb,MYRA – Luxurious Sheer Lace Seduction Bodysuit - Multi Color,Karşı Konulmaz. Dantel. Macera. Dantelde saklı cazibe. İhtişamlı şeffaf dantel özgüven yayar. İddialı tasarım gecenin hâkimiyetini verir. Maceraya bir dokunuş kat. Her meydan okumayı aş. İçinde: Şeffaf dantel balenli body.,in stock,new,62.00 USD,https://mermaidsglance.com/products/heerlaceseductionbodysuit-multicolorZNj9,https://assets.lightfunnels.com/account-99158/images_library/4383f5e7-7a8c-4fcf-b6f9-411081e7c8ad.jpg,MERMAID'S GLANCE,Apparel & Accessories > Clothing > Underwear & Socks > Lingerie
prod_R2FrxXPNaO1g4h7QbwTe1,NALA – Luxury Leopard Print Seduction Set - Animal,Vahşi. Güç. Benzersiz. Vahşi güç lükste yaşar. Ayrış ve cesareti benimse. Çarpıcı leopar deseni iddiasını ortaya koyar. Cesur olmakla değil; vahşi olmakla ilgili. Dizginlenemez enerjinin dışa yansıması. İçinde: Balenli leopar desenli üst ve uyumlu alt parça.,in stock,new,62.00 USD,https://mermaidsglance.com/products/uxuryleopardprintseductionset-animaleibo,https://assets.lightfunnels.com/account-99158/images_library/90216868-2dfa-4d1b-aeb1-0d4c6b387354.jpg,MERMAID'S GLANCE,Apparel & Accessories > Clothing > Underwear & Socks > Lingerie
prod_62EN6rrWc-97FmTFWtyeS,JOAN – Premium Leather Luxury Body Harness - Noir,Lüks. Duruş. Fetih. Aksesuardan fazlası; bir tavır. İddialı stil için seçkin deriden tasarlandı. Her kombini güçlü bir seviyeye taşır. Konfor alanından çık. Güne hükmet. İçinde: Seçkin deri lüks body harness.,in stock,new,62.00 USD,https://mermaidsglance.com/products/premiumleatherluxurybodyharness-noirO2XZ,https://assets.lightfunnels.com/account-99158/images_library/55bc82ed-a4de-44ee-9fa6-bea278bb1c0f.webp,MERMAID'S GLANCE,Apparel & Accessories > Clothing > Underwear & Socks > Lingerie
prod_VDXn7-gPkywfxIvZA_aao,ROSSA – Provocative Sheer Lace Ignition Set - Rouge,Tutku. Detay. Tutuştur. İçindeki cazibeyi uyandır. İddialı tasarım dikkati yönetir. Narin dantel kıvrımların üzerinde cesurca durur. Cesur olmakla değil; tutkuyu tutuşturmakla ilgili. İçindeki ateş. İçinde: Balenli iddialı üst ve uyumlu yüksek kesim alt parça.,in stock,new,62.00 USD,https://mermaidsglance.com/products/rovocativesheerlaceignitionset-rougecAvQ,https://assets.lightfunnels.com/account-99158/images_library/66731420-04f6-4b8f-99d6-a739f7b32801.png,MERMAID'S GLANCE,Apparel & Accessories > Clothing > Underwear & Socks > Lingerie
prod_qUjK_ynuLCg1SdZlEv1xg,RILEY – Bold High-Impact Fishnet Bodysuit - Noir,Etki. Risk. Keskin. Konfor alanından çık. Cesur file tasarım dikkati yönetir. Keskin ve kararlı. Risk almakla değil; fark yaratmakla ilgili. Sınırları zorlamak için doğanlara. İçinde: Tüm bedeni saran şeffaf file body.,in stock,new,55.00 USD,https://mermaidsglance.com/products/yboldhigh-impactfishnetbodysuit-noirHmN3,https://assets.lightfunnels.com/account-99158/images_library/4101f908-5aea-4f0b-ab3b-8044bb2a0300.jpg,MERMAID'S GLANCE,Apparel & Accessories > Clothing > Underwear & Socks > Lingerie
prod_O6kf4TSO_qCclEwvxOEix,ELSA – Premium Second-Skin Body-Hose - Noir,Lüks. Akış. Katman. Bedeni benimse. Seçkin kumaşlar tam gereken noktalara yerleşir. Lüks konforu büyüleyici cazibeye dönüştürür. Rahat ve çekici. Feminenliğin çok katmanlı gücü. İçinde: Seçkin şeffaf body çorabı.,in stock,new,62.00 USD,https://mermaidsglance.com/products/elsapremiumsecond-skinbody-hose-noirwRTB,https://assets.lightfunnels.com/account-99158/images_library/bd76c697-81de-47c1-bd05-f70a5c7fb34f.jpg,MERMAID'S GLANCE,Apparel & Accessories > Clothing > Underwear & Socks > Lingerie
prod_CrWjwmcTiPsCCrF9wyW4n,CLEA – Geometric Halter-Neck Body-Hose - Noir,"Sanat. Desen. Geometri. Bir sanat eserine dönüş. İncelikli geometrik desenlerle boyundan bağlı çizgi. Bedeni baştan sona sarar. Ağı açık detay özgürlük sunar. Siyah dantel tenle bütünleşir. İçinde: Ağı açık, boyundan bağlı body çorabı.",in stock,new,62.00 USD,https://mermaidsglance.com/products/eageometrichalter-neckbody-hose-noirG6_d,https://assets.lightfunnels.com/account-99158/images_library/7ea051d4-a2e0-4754-9763-fde287ded91e.jpg,MERMAID'S GLANCE,Apparel & Accessories > Clothing > Underwear & Socks > Lingerie
prod_wJToF6j2vteSAUqlm88dM,LENOX – Vegan Leather & Lace Lace-Up Bodysuit - Noir,"Dantel. Bağ. Dans. Seni dönüştüren parçalar. Derinin lüksü dantelin inceliğiyle buluşur. Ön bağcıklı tasarım kesin kontrol verir. Stratejik kesikler bedenle bir dans kurar. Cesur değil; gücünü sahipleniyor. İçinde: Bütünleşik jartiyerli, balenli bağcıklı body.",in stock,new,62.00 USD,https://mermaidsglance.com/products/veganleatherlacelace-upbodysuit-noirEdE9,https://assets.lightfunnels.com/account-99158/images_library/6d3959de-ae6d-4b2c-b763-e7311c7171f1.jpg,MERMAID'S GLANCE,Apparel & Accessories > Clothing > Underwear & Socks > Lingerie
prod_vLmNppCOVcpCNsByu-8kf,JESS – Geometric Cutout Mini Dress Set - Noir,Oyun. Kural. Enerji. Eğlendiren setler. Oyuncu kesik detaylar cesur bir dokunuş katar. Eğlenceli olmakla değil; kendi stilini yaşamakla ilgili. Enerjisi zaten özgür olanlara. İçinde: Kesik detaylı mini elbise ve uyumlu iç parça.,in stock,new,55.00 USD,https://mermaidsglance.com/products/jessgeometriccutoutminidressset-noiryiaU,https://assets.lightfunnels.com/account-99158/images_library/8e505d21-d942-418a-8ab9-2542c7e0fd57.png,MERMAID'S GLANCE,Apparel & Accessories > Clothing > Underwear & Socks > Lingerie
prod_fyhx2j76VlzFYvqArAPwG,UNA – Ribbed Essential Set - Noir,"Konfor. Yükseliş. Ruh. Yükselten setler. Sarsılmaz özgüvenin tanımı. Zarif siyah tasarım en yüksek konforu sunar. Gösterişle değil; özgüvenle parlamakla ilgili. Yumuşak, güçlü, unutulmaz. İçinde: Balensiz fitilli üst ve uyumlu alt parça.",in stock,new,62.00 USD,https://mermaidsglance.com/products/unaribbedessentialset-noirSJTk,https://assets.lightfunnels.com/account-99158/images_library/d1331882-bdcf-4ecd-99b6-d717e9755255.jpg,MERMAID'S GLANCE,Apparel & Accessories > Clothing > Underwear & Socks > Lingerie
prod_TuSiWIZYVyhFXkjK-z8h2,KAYLA – Sheer Body-Con Dress Bodysuit - Noir,"Stil. Tül. Özgüven. Stilinle alanını sahiplen. Duruşun dili. Şeffaf yapı zarif bir tül etkisi katar. Özgüvenli ve büyüleyici. Keskin, incelikli bir kendinden eminlik. İçinde: Şeffaf, bedeni saran elbise body.",in stock,new,62.00 USD,https://mermaidsglance.com/products/kaylasheerbody-condressbodysuit-noirjgbR,https://assets.lightfunnels.com/account-99158/images_library/311414bf-7548-4f62-ae5e-b9ab5b699b0f.jpg,MERMAID'S GLANCE,Apparel & Accessories > Clothing > Underwear & Socks > Lingerie
prod_9FH06_8z7xYGARSgdWqdC,LUX – Iridescent Crystal-Embellished Stockings - Noir,Parıltı. Işık. Güç. Aydınlatan çoraplar. Her adıma ışıltı getirir. Parlayan kristallerle süslü. Her silüete sofistike bir ışık katar. Gösterişli değil; içten gelen zarafetle parlak. İçinde: Bir çift kristal süslemeli çorap.,in stock,new,33.00 USD,https://mermaidsglance.com/products/entcrystal-embellishedstockings-noirADyw,https://assets.lightfunnels.com/account-99158/images_library/7f22f7c1-481f-4ad7-b944-867031d05559.webp,MERMAID'S GLANCE,Apparel & Accessories > Clothing > Underwear & Socks > Lingerie
prod_voPDhXCMw0ue84FSDG1sW,VITA – Bold Crotchless Sheer Body-Hose - Noir,"Duruş. Risk. Öz. Özgürlük cesaretle gelir. Risk alanlar için tasarlandı. Ağı açık body çorabı kimliğe cesur bir katman katar. Açıklama gerekmez. Unutulmaz, özgüvenli, vazgeçilmez. İçinde: Ağı açık şeffaf body çorabı.",in stock,new,55.00 USD,https://mermaidsglance.com/products/itaboldcrotchlesssheerbody-hose-noirKbpm,https://assets.lightfunnels.com/account-99158/images_library/b0b20915-497e-4cd0-8722-f771dd750eca.jpg,MERMAID'S GLANCE,Apparel & Accessories > Clothing > Underwear & Socks > Lingerie
prod_BpkUBMVxtxBbWKrqkdicP,XARA – Crotchless All-Over Sheer Fishnet Body - Noir,"div]:bg-bg-000/50 [&_pre>div]:border-0.5 [&_pre>div]:border-border-400 [&_.ignore-pre-bg>div]:bg-transparent [&_.standard-markdown_:is(p,blockquote,h1,h2,h3,h4,h5,h6)]:pl-2 [&_.standard-markdown_:is(p,blockquote,ul,ol,h1,h2,h3,h4,h5,h6)]:pr-8 [&_.progressive-markdown_:is(p,blockquote,h1,h2,h3,h4,h5,h6)]:pl-2 [&_.progressive-markdown_:is(p,blockquote,ul,ol,h1,h2,h3,h4,h5,h6)]:pr-8""> _*]:min-w-0 standard-markdown""> Oyun. File. Serbest. Özgürleştiren parçalar. Baştan sona özgürlüğün ifadesi. File dokusu hayal gücünü besler. Cesur ağı açık detay keskinlik katar. Açıklama gerektirmeden var olan kadın için. İçinde: Ağı açık, tüm bedeni saran file tulum.",in stock,new,55.00 USD,https://mermaidsglance.com/products/tchlessall-oversheerfishnetbody-noir3Ru1,https://assets.lightfunnels.com/account-99158/images_library/c44eb6fa-40ac-4f78-94ee-52d453ca6d9e.png,MERMAID'S GLANCE,Apparel & Accessories > Clothing > Underwear & Socks > Lingerie
prod_89lRGnMPH39UMyyFShKu_,THE SHAE – Patterned High-Impact Garter Stockings,"Oyun. File. Serbest. Özgürleştiren parçalar. Baştan sona özgürlüğün ifadesi. File dokusu hayal gücünü besler. Cesur ağı açık detay keskinlik katar. Açıklama gerektirmeden var olanlara. İçinde: Ağı açık, tüm bedeni saran file tulum.",in stock,new,33.00 USD,https://mermaidsglance.com/products/epatternedhigh-impactgarterstockingsQ6wn,https://assets.lightfunnels.com/account-99158/images_library/41cbf778-8fbc-41bb-b7fd-68612b42c389.webp,MERMAID'S GLANCE,Apparel & Accessories > Clothing > Underwear & Socks > Lingerie
prod_93Ebbehwj1IuwqvWc3wHR,ZIA – Patterned High-Impact Garter Stockings - Pattern,Desen. Darbe. Parıltı. Desende saklı cesaret. Cazibeyi keskin grafik stille birleştirir. İnkâr edilemez bir duruş. Cesur olmakla değil; özgüvenle parlamakla ilgili. Çarpıcı silüet. İçinde: Bir çift desenli jartiyer çorabı.,in stock,new,33.00 USD,https://mermaidsglance.com/products/edhigh-impactgarterstockings-patternRfyB,https://assets.lightfunnels.com/account-99158/images_library/8fec4126-c6e0-4f65-9d63-8b01de487de9.webp,MERMAID'S GLANCE,Apparel & Accessories > Clothing > Underwear & Socks > Lingerie
prod_KtK3LTtEjtF2dPfDKYLxo,DIXIE – Cutout Classic Fishnet Stockings - White,"div]:bg-bg-000/50 [&_pre>div]:border-0.5 [&_pre>div]:border-border-400 [&_.ignore-pre-bg>div]:bg-transparent [&_.standard-markdown_:is(p,blockquote,h1,h2,h3,h4,h5,h6)]:pl-2 [&_.standard-markdown_:is(p,blockquote,ul,ol,h1,h2,h3,h4,h5,h6)]:pr-8 [&_.progressive-markdown_:is(p,blockquote,h1,h2,h3,h4,h5,h6)]:pl-2 [&_.progressive-markdown_:is(p,blockquote,ul,ol,h1,h2,h3,h4,h5,h6)]:pr-8""> _*]:min-w-0 standard-markdown""> File. Klasik. Miras. Modanın yerine zamansızlık. Stratejik kesik detaylarla birleşen klasik beyaz file dokusu. Her silüeti yükseltir. Dikkat çekmekle değil; unutulmaz olmakla ilgili. Sarsılmaz stil. İçinde: Bir çift kesik detaylı file çorap.",in stock,new,33.00 USD,https://mermaidsglance.com/products/ecutoutclassicfishnetstockings-whiteFwhe,https://assets.lightfunnels.com/account-99158/images_library/87d0858b-9119-4dbb-a492-95f0214d0343.webp,MERMAID'S GLANCE,Apparel & Accessories > Clothing > Underwear & Socks > Lingerie
prod_TuO58J2VzEUfxFnJtUs4n,LIZA – Signature Sheer Garter Stockings - Noir,Yükseliş. İpek. Öz. Dönüştüren detaylar. Dönüşümün dili. Aksesuardan fazlası; toplanmış gücün son fırça darbesi. Gerçek güç zarafetin nüansında yaşar. İçinde: Bir çift şeffaf jartiyer çorabı.,in stock,new,33.00 USD,https://mermaidsglance.com/products/zasignaturesheergarterstockings-noirkGeq,https://assets.lightfunnels.com/account-99158/images_library/01bdf8fe-66ba-4cdb-b68c-74d244137030.webp,MERMAID'S GLANCE,Apparel & Accessories > Clothing > Underwear & Socks > Lingerie
