id,title,description,availability,condition,price,link,image_link,brand,google_product_category
prod_aIYregivynpWFtnxFx9zb,VOCA – Bordeaux Satin Striped Bodysuit - Bordeaux,"Nabız. Saten. Bordo. Arzunun sessiz patlaması. Cüreti, bordo saten şeritlerin sıcaklığıyla birleştirir. Işık ve renk çizgileri bedeni çerçeveler. Bir sıcaklık manifestosu. İçinde: Bordo saten şeritli body.",in stock,new,64.00 USD,https://mermaidsglance.com/products/ordeauxsatinstripedbodysuit-bordeauxyMEQ,https://assets.lightfunnels.com/account-99158/images_library/674aaa0e-0de8-431d-9f21-02689310f810.jpg,MERMAID'S GLANCE,Apparel & Accessories > Clothing > Underwear & Socks > Lingerie
prod_Ofx9jbJ-NxPMa-7mMTV3o,CYAN – White & Azure Embroidery Honeymoon Set - White & Blue,"Saf. Gök Mavisi. Yemin. Saflık ve tutku. Kusursuz beyaz dantel, gök mavisi işlemeyle vurgulanır. Bütünleşik choker. Romantizmin eksiksiz bir evrenini kurar. Zarafet her yerde. İçinde: Choker, balenli üst, jartiyer kemeri, tanga, bacak bantları.",in stock,new,97.00 USD,https://mermaidsglance.com/products/zureembroideryhoneymoonset-whiteblue6zJ3,https://assets.lightfunnels.com/account-99158/images_library/58934035-b5fe-4313-8193-b6b08c1c8c93.jpg,MERMAID'S GLANCE,Apparel & Accessories > Clothing > Underwear & Socks > Lingerie
prod_BWxnM5zA1oKn07NLREF-n,ALMA – White Lace & Gold Chain Bodysuit - White & Gold,"Beyaz. Dantel. Altın. Lüksün en sessiz hâli. İşlemeli beyaz dantel, altın zincir detaylarıyla eşleşir. Altın bir kenarla romantik derinlik. Doku, zarafetle buluşur. İçinde: Altın zincirli beyaz dantel body.",in stock,new,72.00 USD,https://mermaidsglance.com/products/whitelacegoldchainbodysuit-whitegoldw5HT,https://assets.lightfunnels.com/account-99158/images_library/2a026dd5-cd1d-453e-9b5a-99f3b5bd13df.jpg,MERMAID'S GLANCE,Apparel & Accessories > Clothing > Underwear & Socks > Lingerie
prod_ZncYdnHG7WwiKCS08wA_7,ROMA – Bordeaux Lace & Gold Chain Bodysuit - Bordeaux,"Bordo. Zincir. Altın. Lüks, bordoda derinleşir. Zengin kızıl dantel, imza altın zincir detaylarıyla vurgulanır. Sofistike, sıcak bir parıltı. Bağırmadan dikkat toplar. İçinde: Altın zincirli bordo dantel body.",in stock,new,72.00 USD,https://mermaidsglance.com/products/rdeauxlacegoldchainbodysuit-bordeauxI8sQ,https://assets.lightfunnels.com/account-99158/images_library/aad0cbdb-d60e-4255-90a9-bf5610e0275e.jpg,MERMAID'S GLANCE,Apparel & Accessories > Clothing > Underwear & Socks > Lingerie
prod_PuKc8kAmvOVeoGDBl8l1-,MALI – White Dotted Tulle & Satin Lace-Up Bodysuit - White,"Puan. Dantel. Cüret. Saf beyaz, saf cüret. Puantiye şeffaf tül, çiçekli işleme ve saten bağcık detaylarıyla buluşur. Beli şekillendirir. Masumiyeti cesur bir çizgiyle dengeler. Kendi çizgilerini belirle. İçinde: Puantiye tüllü, bağcıklı beyaz body.",in stock,new,69.00 USD,https://mermaidsglance.com/products/ottedtullesatinlace-upbodysuit-whiteSqJQ,https://assets.lightfunnels.com/account-99158/images_library/a54d025f-dedb-4258-8c37-02decfe84290.jpg,MERMAID'S GLANCE,Apparel & Accessories > Clothing > Underwear & Socks > Lingerie
prod_gWFeJIJb8JGJztkIIGdKs,NERA – Noir Five-Piece Lace Essential Set - Noir,"Ritüel. Siyah. Bütün. Eksiksiz zarafetin tanımı. Siyah çiçekli dantelde beş parçalı tam bir ritüel. Gölge ile yapının kusursuz dengesi. Sarsılmaz özgüven, tek bir silüette birleşir. İçinde: Balenli üst, tanga, jartiyer kemeri, choker, bacak bantları.",in stock,new,56.00 USD,https://mermaidsglance.com/products/anoirfive-piecelaceessentialset-noir2iWo,https://assets.lightfunnels.com/account-99158/images_library/52d7487a-132f-46b3-ab2d-5e03b03c2538.jpg,MERMAID'S GLANCE,Apparel & Accessories > Clothing > Underwear & Socks > Lingerie
prod_lUM_QGvGEw7ZFFqwRs8za,LUMI – Satin & Lace Detail Night Playsuit - Multi Color,"Oyun. Saten. Üçlü. Üç ton, tek his: incelik. Akışkan saten, göğüste şeffaf dantelle birleşir. Silüet, bedenle birlikte akar. Geceye lüksün bir fısıltısı. İçinde: Dantel detaylı saten playsuit.",in stock,new,52.00 USD,https://mermaidsglance.com/products/inlacedetailnightplaysuit-multicolorEfJc,https://assets.lightfunnels.com/account-99158/images_library/d3a7b407-7e0a-44d6-9211-118fd3eb040e.jpg,MERMAID'S GLANCE,Apparel & Accessories > Clothing > Underwear & Socks > Lingerie
prod_DjjC7euqmTCUfyxOjtgdZ,KIMI – Nude Tulle & Bordeaux Heart Embroidery Set - Nude & Red,"Sessiz. Altın. Tempo. Sessizlik, en büyük lüks. Şeffaf siyah tül, zarif altın mücevher detaylarıyla vurgulanır. Sessiz zarafeti yükseltmek için tasarlanmış dört parça. Yavaş, ölçülü bir tempoyla hareket eder. İçinde: Altın detaylı üst, tanga, jartiyer kemeri, bacak halkaları.",in stock,new,87.00 USD,https://mermaidsglance.com/products/lebordeauxheartembroideryset-nuderedlcf3,https://assets.lightfunnels.com/account-99158/images_library/7ccbf52b-d658-4178-8b56-93a1914fb725.jpg,MERMAID'S GLANCE,Apparel & Accessories > Clothing > Underwear & Socks > Lingerie
prod_GerMbfIaBRSaOP5zxm6gy,ZIVA – Noir Tulle & Gold Jewelry Lingerie Set - Noir & Gold,"Sessiz. Altın. Tempo. Sessizlik, en büyük lüks. Şeffaf siyah tül, zarif altın mücevher detaylarıyla vurgulanır. Sessiz zarafeti yükseltmek için tasarlanmış dört parça. Yavaş, ölçülü bir tempoyla hareket eder. İçinde: Altın detaylı üst, tanga, jartiyer kemeri, bacak halkaları.",in stock,new,88.00 USD,https://mermaidsglance.com/products/tullegoldjewelrylingerieset-noirgoldkWva,https://assets.lightfunnels.com/account-99158/images_library/7a80fece-8d03-4853-9a51-d0a3d638b808.jpg,MERMAID'S GLANCE,Apparel & Accessories > Clothing > Underwear & Socks > Lingerie
prod_hIhgRm5IRnHJ_gaPT9PrL,YUNA – White Sheer Mesh & Gold Chain Bodysuit - White & Gold,Saf. Zincir. Altın. Altınla rafine edilen saflık. Şeffaf beyaz filenin masumiyeti altın tonlu zincirlerin ihtişamıyla buluşur. Entegre bacak halkası. Işık ve lüksün çizgisi. İçinde: Altın zincirli şeffaf beyaz body.,in stock,new,72.00 USD,https://mermaidsglance.com/products/sheermeshgoldchainbodysuit-whitegoldH64l,https://assets.lightfunnels.com/account-99158/images_library/6a3bf8ea-5457-4b57-a1f8-1c19e33f9256.jpg,MERMAID'S GLANCE,Apparel & Accessories > Clothing > Underwear & Socks > Lingerie
prod_Myl06rmvKmiLT5_aSkapw,MINA – Leopard Mesh & Silver Detail Three-Piece Set - Animal,"Ateşli. Leopar. Gümüş. Fileden süzülen bir vahşilik. Leopar desenin ham enerjisi, serin gümüş detaylarla buluşur. İçgüdünün modern yorumu. Sessizce cesur. İnkâr edilemez bir varlık. İçinde: Dolgusuz file üst, jartiyer kemeri, tanga.",in stock,new,82.00 USD,https://mermaidsglance.com/products/eshsilverdetailthree-pieceset-animalcGId,https://assets.lightfunnels.com/account-99158/images_library/11d8036e-8ede-47c2-aecc-7bd9bd73796f.jpg,MERMAID'S GLANCE,Apparel & Accessories > Clothing > Underwear & Socks > Lingerie
prod_lFUh061H_cmaNxO8Blkd6,DANA – Rouge Five-Piece Lace Essential Set - Rouge,"Ritüel. Kırmızı. Bütün. Zarafet bir ritüele dönüşür. Kırmızı çiçekli dantelde duyulara işleyen eksiksiz bir deneyim. Sıcaklığı serin bir yapıyla dengeler. Tek bir bütün. Eksiksizliği talep eder. İçinde: Balenli üst, tanga, jartiyer kemeri, choker, bacak bantları.",in stock,new,56.00 USD,https://mermaidsglance.com/products/ougefive-piecelaceessentialset-rougeei4C,https://assets.lightfunnels.com/account-99158/images_library/19f0c5c5-acfb-465a-8da6-061502ad0b02.jpg,MERMAID'S GLANCE,Apparel & Accessories > Clothing > Underwear & Socks > Lingerie
prod_pEyPWSMVfuhXjkW3oyUGj,SIVA – Leopard Accent Cupless Strappy Set - Animal,"Vahşi. Fısıltı. Hakimiyet. Zarafetin en cesur yorumu. Bantlar örtmek yerine tanımlar. Boyna doğru zarafetle yükselir. Leopar detaylı tanga. Fark edilme sanatı. İçinde: Açık kup bantlı üst, jartiyer kemeri, leopar tanga.",in stock,new,86.00 USD,https://mermaidsglance.com/products/eopardaccentcuplessstrappyset-animalStmC,https://assets.lightfunnels.com/account-99158/images_library/1f6653e7-752e-4a82-953b-be5a9633968f.jpg,MERMAID'S GLANCE,Apparel & Accessories > Clothing > Underwear & Socks > Lingerie
prod_OYCI2HCrPgUeL0cnGnw2T,ELIN – Gold Chain & Lace Luxury Bodysuit - Noir & Gold,"Mücevher. Dantel. Altın. Lüksün ince çizgisi. Narin dantel altın zincirlerin ağırlığıyla buluşur. Bedeni hafifçe sarar. Ayarlanabilir yapı. Zarif. Hükmeden. İçinde: Altın zincirli dantel body, bacak halkası.",in stock,new,60.00 USD,https://mermaidsglance.com/products/goldchainlaceluxurybodysuit-noirgoldL1ia,https://assets.lightfunnels.com/account-99158/images_library/bad39b14-f5dd-4b14-9a7e-fcb2408132cf.jpg,MERMAID'S GLANCE,Apparel & Accessories > Clothing > Underwear & Socks > Lingerie
prod_cSFIooLWb6LsxE389zRsf,SENA – Rouge Soft-Cup Underwired Set - Rouge,"Sıcak. Doğal. Kırmızı. Zarafetin yalınlığı. Yumuşak dokulu kup yapısı bedeni sarar. Kırmızı tonu yumuşak bir sıcaklık yaratır. Sessiz özgüven. Rahatlığa odaklı tasarım. İçinde: Yumuşak yapılı balenli üst, uyumlu string.",in stock,new,74.00 USD,https://mermaidsglance.com/products/senarougesoft-cupunderwiredset-rouge-ZD4,https://assets.lightfunnels.com/account-99158/images_library/7d1f632d-0604-4889-8057-e64fd6120f8d.jpg,MERMAID'S GLANCE,Apparel & Accessories > Clothing > Underwear & Socks > Lingerie
prod_k3NIpq3kXi6p7kD7phjJ_,XIA – Strappy Harness Backless Bodysuit - Noir,"Heykel. Bant. Biçim. Cesaret bir çizgiyle başlar. Ayarlanabilir siyah bantlar bedeni bir heykel gibi sarar. Balenli yapı silüeti nazikçe yükseltir. Çizgiyi tamamla. İçinde: Harness body, bacak bantları.",in stock,new,76.00 USD,https://mermaidsglance.com/products/astrappyharnessbacklessbodysuit-noir7hFg,https://assets.lightfunnels.com/account-99158/images_library/38d098e8-fb85-4e94-b886-84ed90d047df.jpg,MERMAID'S GLANCE,Apparel & Accessories > Clothing > Underwear & Socks > Lingerie
prod_1SYXRYzc0rOwsZKoKZtnx,CYRA – Azure Soft-Cup Underwired Set - Blue,"Berrak. Serin. Gök Mavisi. Rahatlığın berrak çizgisi. Yumuşak, dolgusuz balenli form doğal silüeti belirginleştirir. Serin gök mavisi görünümü hafifletir. Minimal duruş. En yüksek etki. İçinde: Dolgusuz balenli üst, uyumlu tanga.",in stock,new,74.00 USD,https://mermaidsglance.com/products/cyraazuresoft-cupunderwiredset-blueyBXs,https://assets.lightfunnels.com/account-99158/images_library/b4dc2fbd-e1e5-4106-9b69-e8dfc7c17e3d.jpg,MERMAID'S GLANCE,Apparel & Accessories > Clothing > Underwear & Socks > Lingerie
prod_BE0YyhNmkbuoY9mmUkzYo,NIMA – Noir Satin & Gold Chain Lingerie Set - Noir & Gold,"Zincir. Saten. Siyah. Cesaretin en yalın biçimi. Siyah satenin sessiz ihtişamı, merkezdeki altın zincirle buluşur. Dantel yok, karmaşa yok. Yalnızca net bir duruş. Zamansız bir zarafet anı. İçinde: Saten üst, tanga, jartiyer kemeri, altın detaylar.",in stock,new,68.00 USD,https://mermaidsglance.com/products/irsatingoldchainlingerieset-noirgoldguai,https://assets.lightfunnels.com/account-99158/images_library/a257c22b-861e-47bb-88e1-eee83dea3f20.jpg,MERMAID'S GLANCE,Apparel & Accessories > Clothing > Underwear & Socks > Lingerie
prod_lSAZDulpU-ZX7sVg5jXle,RINA – Rouge & Gold Hardware Strappy Lingerie Set - Rouge,"Gölge. Altın. Kırmızı. Gölgeler derinleşir; gizem açılır. Kırmızının sıcaklığı altın metal detayların serin dokunuşuyla buluşur. Çift katlı balenli yapı. Askılı mimari. Rahatlık ile cüret dengede. İçinde: Balenli üst, tanga, jartiyer kemeri, bacak bantları.",in stock,new,80.00 USD,https://mermaidsglance.com/products/goldhardwarestrappylingerieset-rougeEoix,https://assets.lightfunnels.com/account-99158/images_library/a5f9c809-8d0e-4c1b-aba9-aa447a2123f2.jpg,MERMAID'S GLANCE,Apparel & Accessories > Clothing > Underwear & Socks > Lingerie
prod_Ebk1w6pmO3Re2KcYbCW7I,VOSS – Sheer Tulle Suspender Bodysuit - Noir,"Çizgi. Keskin. Tül. Siyahın her tonu. Şeffaf tül mimari çizgilerle buluşur. Bantlar göğüsten boyna yükselir. Duruşu tanımlar. Bedeni keskin zarafetin merkezine alır. İçinde: Jartiyer askılı şeffaf tül body, bacak bantları.",in stock,new,70.00 USD,https://mermaidsglance.com/products/vosssheertullesuspenderbodysuit-noirIOgo,https://assets.lightfunnels.com/account-99158/images_library/4a5e6a2c-5fd7-46eb-a6d5-c41081444281.jpg,MERMAID'S GLANCE,Apparel & Accessories > Clothing > Underwear & Socks > Lingerie
prod_DUDogirG7xuMKeik1lzlg,NUNA – Satin & Lace Open-Back Nightdress - Noir,"Akış. Saten. Ritüel. Yumuşaklık bir ritüele dönüşür. Akışkan saten bedene dökülür. Göğüs çizgisindeki şeffaf dantel kadınsı bir dokunuş katar. Cesur, açık sırt. Sessiz lüksün özü. İçinde: Dantel detaylı saten gecelik.",in stock,new,56.00 USD,https://mermaidsglance.com/products/unasatinlaceopen-backnightdress-noirOn2L,https://assets.lightfunnels.com/account-99158/images_library/15f19e26-33ca-40f1-895e-0c0f05f517fc.jpg,MERMAID'S GLANCE,Apparel & Accessories > Clothing > Underwear & Socks > Lingerie
prod_psglzEittfjznuiF3v83k,BREE – Dotted Tulle & Ruffled Strap Bodysuit - Noir,"Esinti. Puantiye. Ritim. Havada asılı bir zarafet. Tende puantiyeli tül. Fırfırlı askılar görünmez bir ritim katar. Ortadaki halka bakışı toplar. Zahmetsiz, hafif bir incelik. İçinde: Puantiyeli tül body ve bacak bantları.",in stock,new,96.00 USD,https://mermaidsglance.com/products/dottedtulleruffledstrapbodysuit-noiruxte,https://assets.lightfunnels.com/account-99158/images_library/7fce688b-f588-4f4a-b6ae-1f59dcab0380.jpg,MERMAID'S GLANCE,Apparel & Accessories > Clothing > Underwear & Socks > Lingerie
prod_hdpPvoFI-1dIQUGodZ0sA,ROJA – Rouge Floral Lace Five-Piece Set - Rouge,"Kırmızı. Evre. Bütün. Kırmızının gücü, zarafetle yorumlanır. Çarpıcı kırmızı dantelde beş parçalı eksiksiz bir deneyim. Hafiflik ile desteği dengeler. Gecenin ritmini belirler. İçinde: Balenli üst, jartiyer kemeri, tanga, bacak bantları.",in stock,new,80.00 USD,https://mermaidsglance.com/products/jarougeflorallacefive-pieceset-rougeO3gA,https://assets.lightfunnels.com/account-99158/images_library/8f08474c-7912-4bfa-9a23-d682bb4dda9c.jpg,MERMAID'S GLANCE,Apparel & Accessories > Clothing > Underwear & Socks > Lingerie
prod_WalzuzP9Tonyxj1QaVPql,NILA – Satin Slip Dress with Chain Slit - Noir,"Saten. Yırtmaç. Zincir. Gece bir ritüele dönüşür. Akışkan saten bedene dökülür. Altın zincirlerle birleşen sofistike yan yırtmaç. Cesur, açık sırt. Yumuşaklık metalle buluşur. İçinde: Zincir detaylı saten slip elbise.",in stock,new,60.00 USD,https://mermaidsglance.com/products/nilasatinslipdresswithchainslit-noirI3Wl,https://assets.lightfunnels.com/account-99158/images_library/ee48be40-11b6-4c6e-9db4-d175387e4eb2.jpg,MERMAID'S GLANCE,Apparel & Accessories > Clothing > Underwear & Socks > Lingerie
prod_nKhrVOktxeRP8QDkZxS_z,KNOX – Silver Chain & Vegetable Leather Harness - Noir,"Gümüş. Bağ. Deri. Çizginin gücünü hisset. Bitkisel tabaklanmış deri, gümüş zincirlerle buluşur. Kısa askılı modern harness. Silüeti mimari bir otoriteyle çerçeveler. Kontrol sende. İçinde: Gümüş zincirli deri harness; iç giyim dahil değildir.",in stock,new,50.00 USD,https://mermaidsglance.com/products/verchainvegetableleatherharness-noirx0ZA,https://assets.lightfunnels.com/account-99158/images_library/524bf2c1-10fc-460d-8c88-54328e24ff44.jpg,MERMAID'S GLANCE,Apparel & Accessories > Clothing > Underwear & Socks > Lingerie
prod_6fD5GD8KQ5Q_-ygiJ2bF_,VIVA – Geometric Strap-Constructed Bodysuit - Noir,Sansür. Çerçeve. Biçim. Cesaret geometride zarafetle buluşur. Bütünüyle ayarlanabilir askılardan kurulan heykelsi bir parça. Kontrollü açıklıkla bedeni çerçeveler. Minimal ve anıtsal. İçinde: Askılı geometrik body.,in stock,new,64.00 USD,https://mermaidsglance.com/products/metricstrap-constructedbodysuit-noir4d_C,https://assets.lightfunnels.com/account-99158/images_library/3573f958-db96-481f-b946-5e70da0f4bb4.jpg,MERMAID'S GLANCE,Apparel & Accessories > Clothing > Underwear & Socks > Lingerie
prod_PmO-LMGwTB-BdQ85vZeLr,ILSA – Gold Chain Accent Four-Piece Lace Set - Noir & Gold,"Özgürlük. Zincir. Altın. Lüks sınır tanımaz. Sofistike altın zincir dokunuşlarıyla ince siyah dantel. Dört parçalı eksiksiz bir kürasyon. Bedeni yaldızlı zarafetin manzarasına dönüştürür. İçinde: Zincir detaylı üst, tanga, jartiyer kemeri, bacak halkaları.",in stock,new,81.00 USD,https://mermaidsglance.com/products/hainaccentfour-piecelaceset-noirgoldqnAz,https://assets.lightfunnels.com/account-99158/images_library/47a3fe53-9ee4-4ab9-9298-41ebf45a8112.jpg,MERMAID'S GLANCE,Apparel & Accessories > Clothing > Underwear & Socks > Lingerie
prod_U3qXkWQXYBVkzyiPbukd2,KAZ – Soft-Cup Bodysuit with Thigh Loops - Noir,"Belirgin. Halka. Yumuşak. Sınırlar net. Yumuşak kup mimarisi sert dolgu olmadan biçim verir. Bütünleşik bacak halkaları çizgiyi uzatır. Modern, ayırt edici, tartışmasız güçlü. İçinde: Yumuşak kuplu, bütünleşik bacak halkalı body.",in stock,new,89.00 USD,https://mermaidsglance.com/products/zsoft-cupbodysuitwiththighloops-noirT2aC,https://assets.lightfunnels.com/account-99158/images_library/72b8dc5f-83ec-46f3-a164-8db5c9314a54.jpg,MERMAID'S GLANCE,Apparel & Accessories > Clothing > Underwear & Socks > Lingerie
prod_Mk6nRtCw86WDE5flw_9Rc,LUZ – Reversible Gold Body Chain with Velvet Touch - Gold,İki Yön. Dokunuş. Altın. Çıplak hâliyle zarafet. Çift yönlü tasarım önde veya sırtta süzülür. İç yüzü kadife yumuşaklığında bir dokuyla kaplıdır. Tek dokunuşla silüeti dönüştürür. Lüksün fısıltısı. İçinde: Çift yönlü altın tonlu beden zinciri.,in stock,new,26.00 USD,https://mermaidsglance.com/products/blegoldbodychainwithvelvettouch-goldvJPV,https://assets.lightfunnels.com/account-99158/images_library/54979ddc-c4ee-4c26-b003-81e6742c2f5c.jpg,MERMAID'S GLANCE,Apparel & Accessories > Clothing > Underwear & Socks > Lingerie
prod_Ak3D30EFaNCH3raP8LnRl,ANA – Essential Sheer Two-Piece Set - Noir,"Sessiz. Esnek. Şeffaf. Sessiz güç sadelikte yaşar. Şeffaf ve esnek iki parçalı bütün, ikinci ten gibi hareket eder. Orta belli kesim doğal çizgileri izler. Her güne ait saf, gösterişsiz özgüven. İçinde: Şeffaf bralet, orta belli alt parça.",in stock,new,50.00 USD,https://mermaidsglance.com/products/anaessentialsheertwo-pieceset-noirs4fp,https://assets.lightfunnels.com/account-99158/images_library/63001a80-5eff-4cd0-b8cf-10381acf2976.jpg,MERMAID'S GLANCE,Apparel & Accessories > Clothing > Underwear & Socks > Lingerie
prod_8MVyYmp-xWigCnCBCdHIw,ZITA – Floral Embroidery & Satin Finish Three-Piece Set - Crimson,"Hazır. Çiçek. Çerçeve. Zarafetin sınırlarını ileri taşı. İnce çiçek işlemeleri saten bitişlerle yumuşar. Balenli üst formu çerçeveler. Yüksek belli jartiyer kemeri bakışı yönlendirir. Her çizgide hazır bir duruş. İçinde: Balenli işlemeli üst, jartiyer kemeri, yüksek kesim tanga.",in stock,new,80.00 USD,https://mermaidsglance.com/products/erysatinfinishthree-pieceset-crimsonAnyO,https://assets.lightfunnels.com/account-99158/images_library/e4d6e876-4360-4f3e-b7dc-8d3b3f4761f9.jpg,MERMAID'S GLANCE,Apparel & Accessories > Clothing > Underwear & Socks > Lingerie
prod_CtHMkbl3x73boAzS8kf1b,BEA – Gold-Tone Minimal Body Chain - Gold,Altın. Çizgi. Öz. En sessiz dokunuş en güçlüdür. Tek ve zarif bir altın çizgiyle silüeti tanımlar. Tenin veya giysinin üzerinde taşınan sofistike ışık. İçteki ışıltının dışa yansıması. İçinde: Ayarlanabilir altın tonlu beden zinciri.,in stock,new,26.00 USD,https://mermaidsglance.com/products/beagold-toneminimalbodychain-goldCeLR,https://assets.lightfunnels.com/account-99158/images_library/fb11ba64-5b8b-4301-8c92-d8f56c944c3a.jpg,MERMAID'S GLANCE,Apparel & Accessories > Clothing > Underwear & Socks > Lingerie
prod_T1fViLFgZuCyD5mHNXDX6,DREA – Gold Chain Detail Sheer Mesh Bodysuit - Noir & Gold,"Altın. Zincir. Bağ. Altınla rafine edilen vahşilik. Şeffaf filenin hafifliği, altın tonlu zincir detaylarının lüksüyle dengelenir. Bütünleşik bacak halkası çizgiyi uzatır. Minimal bir dokunuş, azami etki. İçinde: Altın zincirli ve bacak halkalı şeffaf body.",in stock,new,77.00 USD,https://mermaidsglance.com/products/haindetailsheermeshbodysuit-noirgold8ynj,https://assets.lightfunnels.com/account-99158/images_library/8a78ada0-58cc-4f39-bb27-5d00cf611f02.jpg,MERMAID'S GLANCE,Apparel & Accessories > Clothing > Underwear & Socks > Lingerie
prod_MlG8Ojnhha6ZLAIb56JX5,COLE – Vegetable-Tanned Leather Body Harness - Noir,"Deri. Taş. Sessizlik. Güç deride fısıldar. Kadife yumuşaklığında astarla desteklenen bitkisel tabaklanmış deri. Gümüş tonlu metal detaylar kontrollü bir otorite katar. Koyu, dayanıklı, lüks. İçinde: Deri body harness; iç giyim dahil değildir.",in stock,new,74.00 USD,https://mermaidsglance.com/products/etable-tannedleatherbodyharness-noirKoyQ,https://assets.lightfunnels.com/account-99158/images_library/553249b0-3c90-446a-ace7-44438211c827.jpg,MERMAID'S GLANCE,Apparel & Accessories > Clothing > Underwear & Socks > Lingerie
prod_Uzhif-UnLPpDRQqd9G1U4,MICA – Handcrafted Crystal Choker Harness - Crystal,Kıvılcım. Mücevher. Çizgi. Tende çizilen bir ışık hattı. Işıldayan kristallerle elde biçimlendirilir. Her silüeti bir ifadeye dönüştürür. Zarafet ile keskinliğin buluştuğu noktayı belirler. İçinde: Kristal choker harness; iç giyim dahil değildir.,in stock,new,44.00 USD,https://mermaidsglance.com/products/dcraftedcrystalchokerharness-crystal_AIr,https://assets.lightfunnels.com/account-99158/images_library/11320b41-e19a-4d67-a753-fb5410cb2055.jpg,MERMAID'S GLANCE,Apparel & Accessories > Clothing > Underwear & Socks > Lingerie
prod_XP1a0L-wsYr9hwk6sdeRo,ASTRA – Five-Piece Noir Lace Choker Set - Noir,"Gölge. Evre. Bütün. Cazibe gölgelerden yükselir. Beş parçalı eksiksiz bir bütün. Siyah çiçekli dantel, gölgeli zarafeti baştan sona taşır. Choker bakışı çerçeveler. Geceye ait bir kompozisyon. İçinde: Choker, balenli üst, jartiyer kemeri, tanga, bacak bantları.",in stock,new,66.00 USD,https://mermaidsglance.com/products/strafive-piecenoirlacechokerset-noirh2Vf,https://assets.lightfunnels.com/account-99158/images_library/11f1e4bf-b268-4535-b010-467a841b7f98.jpg,MERMAID'S GLANCE,Apparel & Accessories > Clothing > Underwear & Socks > Lingerie
prod_Vqou_2qL-BGTfwvSpGrFR,ALIA – Soft Mesh Cross-Back Bodysuit - Noir,"Yumuşak. Bilgelik. Döngü. Cazibe yumuşaklıkta biçim bulur. Şerit tül yapı tende ağırlıksız durur. Çapraz sırt lastikleri modern destek sunar. Beden ile file arasında sessiz bir diyalog. İçinde: Çapraz sırtlı, bütünleşik bacak halkalı file body.",in stock,new,74.00 USD,https://mermaidsglance.com/products/aliasoftmeshcross-backbodysuit-noirPI6I,https://assets.lightfunnels.com/account-99158/images_library/ba362d50-8864-4e88-bf04-53d813ed9857.jpg,MERMAID'S GLANCE,Apparel & Accessories > Clothing > Underwear & Socks > Lingerie
prod_wVVEQrtVG1Fa7OzbdRAYc,ROCA – Wide-Strap Elastic Bandage Lingerie Set - Noir,"Gece. İddia. Vahşi. Çizgiler silüeti sahiplenir. Mimari elastik bantlar ve geniş, ayarlanabilir askılar. Bedeni kontrollü bir cesaretle çerçeveler. Dantelsiz. Saf yapı, saf niyet. İçinde: Geniş askılı üst, alt parça, jartiyer kemeri ve bacak bantları.",in stock,new,70.00 USD,https://mermaidsglance.com/products/-strapelasticbandagelingerieset-noiraRAT,https://assets.lightfunnels.com/account-99158/images_library/a7d758b8-43af-488b-8851-5bee8eb41cd0.jpg,MERMAID'S GLANCE,Apparel & Accessories > Clothing > Underwear & Socks > Lingerie
prod_WETgvPZUxD1okHqHLLNh9,CALA – Open-Texture Lace Four-Piece Set - Noir,"Doku. Çiçek. Bütün. Zarafet, parçalarının toplamıdır. Likra katkılı açık dokulu dantel ikinci ten gibi hareket eder. Silüet üzerinde çiçekli bir harita kurar. Giyinmek değil; tamamlanmak. İçinde: Balenli üst, alt parça, jartiyer kemeri, dantel bacak bantları.",in stock,new,70.00 USD,https://mermaidsglance.com/products/laopen-texturelacefour-pieceset-noir2jTA,https://assets.lightfunnels.com/account-99158/images_library/8811570c-7420-4adf-adaa-9e2af5efb197.jpg,MERMAID'S GLANCE,Apparel & Accessories > Clothing > Underwear & Socks > Lingerie
prod_3bIhP_3PE6Gm3zAgNIfTY,ANJA – Rouge Floral Lace & Thigh-Loop Set - Rouge,"Kırmızı. Halka. Ateş. Ateş sessizce yanar. Bedeni kırmızı çiçekli dantelle sarar. Biçim veren jartiyer kemeri çizgiyi sabitler. Esnek bacak halkaları. Sıcaklığı mimari çizgilerle dengeler. İçinde: Balenli dantel üst, biçim veren jartiyer kemeri, tanga, bacak halkaları.",in stock,new,68.00 USD,https://mermaidsglance.com/products/jarougeflorallacethigh-loopset-rougeFaDH,https://assets.lightfunnels.com/account-99158/images_library/fac86015-3266-4d65-aa5f-1e779344b680.jpg,MERMAID'S GLANCE,Apparel & Accessories > Clothing > Underwear & Socks > Lingerie
prod_Jp7eQj9FRYVjWRGTzSbhe,VELA – Sheer Guêpière Strap-Detail Bodysuit - Noir,"Silüet. Askı. Guêpière. Sessizlik otoritedir. İnce siyah file, guêpière esintili çizgilerle biçim verir. Uzatılmış askı detayları bakışı yukarı taşır. Arzunun dikey mimarisi. Kontrollü zarafet. İçinde: Şeffaf, askı detaylı body.",in stock,new,74.00 USD,https://mermaidsglance.com/products/sheergupirestrap-detailbodysuit-noirW486,https://assets.lightfunnels.com/account-99158/images_library/ec58cb24-4bcd-40eb-923a-2c56286907c1.jpg,MERMAID'S GLANCE,Apparel & Accessories > Clothing > Underwear & Socks > Lingerie
