id,title,description,availability,condition,price,link,image_link,brand,google_product_category
prod_MyDN3HgSeEZTuYF8saBKM,Margaux – Dantel Balconet Sütyen & Jartiyer Set – Kırmızı,"Tehlike. Hüküm. Margaux. Kırmızı saten, teni sarar. Dantel kupalar, hatları çizer. Sırtındaki kafes kayış bir süs değil — duruşun parçası. Her toka yerli yerinde. Bu silüet izin istemez, fark edilir. İçinde: Balenli balconet üst, saten mini etek, jartiyer kayışları, uyumlu tanga, çıkarılabilir saten kayış.",in stock,new,60.00 USD,https://mermaidsglance.com/products/margaux-dantel-balconet,https://assets.lightfunnels.com/account-99158/images_library/e1a2b390-3729-445f-afd3-b618c5940d53.jpg,MERMAID'S GLANCE,Apparel & Accessories > Clothing > Underwear & Socks > Lingerie
prod_exVX9ZwjEg6AHor8Ov4ef,CHRISTINE – Scalloped Lace Strappy Garter Set - Black,"Yumuşaklık. Kesildi. Christine. İnce kirpik dantel sahte bir yumuşaklık vaadi sunar. Christine bu inceliği jilet-ince mimari askılarla çerçeveler; teninin sınırlarını sertçe dikte eder. Jartiyer kemerinin acımasız yapısı yoruma yer bırakmaz. Klipsleri tuttur. Kırılgan bir cephe sunarsın, arkasında mutlak ve sarsılmaz bir otorite. İçinde: İnce askı detaylı balenli üst, kirpik dantel bordürlü jartiyer kemeri, uyumlu tanga, ayarlanabilir bacak askıları.",in stock,new,84.00 USD,https://mermaidsglance.com/products/escallopedlacestrappygarterset-blackZLZx,https://assets.lightfunnels.com/account-99158/images_library/9afc9b08-f823-405e-9146-95e986bc5443.jpg,MERMAID'S GLANCE,Apparel & Accessories > Clothing > Underwear & Socks > Lingerie
prod_Tm8PAo4qhTVp08vqZJ1Vx,FLORENCE – Sheer Bra With Metallic Nipple Covers - Black,"Zırh. Kuşanıldı. Florence. Teşhir bir taktiktir; metalik zırh bir uyarıdır. Florence şeffaf siyah fileyi tam tepede soğuk, tavizsiz metalik örtülerle buluşturur. Pileli jartiyer kemeri ve zincir donanımı kalçalara ağır, teatral bir otorite katar. Bunu giy. Beklentiyi ortadan kaldırır, yerine saf görsel felç bırakırsın. İçinde: Entegre metalik tepe örtülü şeffaf siyah üst, zincir donanımlı pileli yan jartiyer kemeri, uyumlu tanga, bacak askıları.",in stock,new,60.00 USD,https://mermaidsglance.com/products/eerbrawithmetallicnipplecovers-blackgHMK,https://assets.lightfunnels.com/account-99158/images_library/65d8077f-8c8b-41a6-b1e7-9b027a83d49d.jpg,MERMAID'S GLANCE,Apparel & Accessories > Clothing > Underwear & Socks > Lingerie
prod_D_yKkufleZt5fbr4wWm4t,JACQUELINE – Thick Satin Strappy Harness Set - Black,"Disiplin. Kuşatıldı. Jacqueline. Saten genelde konfor sunar. Jacqueline onu bir kafes kurmak için kullanır. Kalın siyah bantlar boğazı doğrudan göğse bağlar; soğuk rose-gold donanım niyetinin sürekli fiziksel hatırlatıcısıdır. Harness'i sabitle. Güç dengesi, içeri girdiğin an kalıcı olarak kayar. İçinde: Saten balenli üst, bağlı çoker harness, kalın askılı jartiyer kemeri, uyumlu tanga, bacak askıları, rose-gold tonlu donanım.",in stock,new,60.00 USD,https://mermaidsglance.com/products/inethicksatinstrappyharnessset-blackR3yK,https://assets.lightfunnels.com/account-99158/images_library/a3f15858-102b-43ab-8d96-a76c60af816c.jpg,MERMAID'S GLANCE,Apparel & Accessories > Clothing > Underwear & Socks > Lingerie
prod_Tr8vUc9fNn6mnNZsx1Yvn,MARCELLA – Noir Nightgown with Integrated Garters - Noir,"Jartiyer. Fırfır. Marcella. Geceliği yeniden tanımlar. Entegre jartiyerler. Uyluk bantları dahil. Tek parça, tam etki. İşlemeli dantel göğsü biçimler. Fırfırlar romantik bir dokunuş katar. Şeffaf tül zarifçe açığa çıkarır. Zahmetsiz baştan çıkarma. İçinde: Entegre jartiyerli gecelik, uyluk bantları.",in stock,new,60.00 USD,https://mermaidsglance.com/products/rnightgownwithintegratedgarters-noir75kJ,https://assets.lightfunnels.com/account-99158/images_library/81a473bc-9cb1-46c5-9fcd-a43baf50cdf2.jpg,MERMAID'S GLANCE,Apparel & Accessories > Clothing > Underwear & Socks > Lingerie
prod_n_axR7Wh9UHX01lNq-Lnc,ARABELLA – Rouge Heart Embroidery Tulle Nightgown - Rouge,"Tutku. Kalp. Arabella. Aşkın cüretkâr hali. Kalp işlemesi bedenini zarifçe çizer. Tutkulu kırmızı konuşmadan sahiplenir. Şeffaf tül kalçalarda hafifçe akar. Açık sırt kontrollü bir cesaret sunar. Yan kesimler doğal biçim verir. İçinde: Kalp işlemeli gecelik, uyumlu tanga.",in stock,new,64.00 USD,https://mermaidsglance.com/products/eheartembroiderytullenightgown-rougec8nt,https://assets.lightfunnels.com/account-99158/images_library/f1fe1f75-6e10-4e1b-9226-2ccf34823367.jpg,MERMAID'S GLANCE,Apparel & Accessories > Clothing > Underwear & Socks > Lingerie
prod_49YrwRo08rM7jfGW33rin,Kimono for women - Thalia,"THALIA — İşleme. Saten. Görünür Lüks. THALIA, zarafetin en rafine hâlidir. İşlemeli dantel teninde çiçekler çizer. Saten yaka yapıyı kurar. Saten manşetler lüksü ilan eder. Kemer belini tanımlar. Bu sıradan bir şeffaf kimono değil. Kalitenin ilk bakışta görüldüğü parça. Dantel tene hafifçe dokunur. Floral desenler zarafetle ortaya çıkar. Saten bitişler görünümü yükseltir. Aynada: cesur, sofistike, kusursuz. Kalite kendi kendini anlatır. Kimono İçeriği • Şeffaf işlemeli siyah dantel kimono • Tamamı floral işlemeli desenler • Siyah saten yaka • Siyah saten manşetler • Siyah saten bel kemeri • 3/4 kollar • Diz üstü uzunluk Neden Seveceksin • İşlemeli dantel: kalite ilk dokunuşta hissedilir • Saten bitişler: yaka ve manşetlerde görünür lüks • Rafine floral desen: seçkin ve sofistike • Kontrollü transparan: cesur ama her zaman zarif Teknik Kompozisyon: %85 poliamid, %15 elastan. Siyah işlemeli dantel, siyah saten. Bakım: Elde yıkama, düz kurutma. Beden: Kemer sayesinde tek beden uyumlu. Sunum & Deneyim THALIA kimono, Mermaid’s Glance imza siyah kutusunda, saten kesesiyle sunulur. Hediye etmeye hazır. Veya kendin için saklamaya.",in stock,new,70.00 USD,https://mermaidsglance.com/products/kimonoforwomen-thaliatYl4,https://assets.lightfunnels.com/account-99158/images_library/610e875b-8d31-442a-b1f8-ecda14e31195.jpg,MERMAID'S GLANCE,Apparel & Accessories > Clothing > Underwear & Socks > Lingerie
prod_tnpuwDlG14-mRJ9kr3qfr,AMALIA – Noir Heart Embroidery Tulle Nightgown - Noir,"Kalp. Noir. Amalia. Sahiplenilen çekim. Kalp işlemesi göğsü zarifçe biçimler. Siyahın zarafeti tende akar. Şeffaf tül kalçalarda hafifçe dans eder. Açık sırt kontrollü bir cesaret katar. Yan kesimler beli doğal olarak inceltir. Unutulmaz. İçinde: Kalp işlemeli gecelik, uyumlu tanga.",in stock,new,70.00 USD,https://mermaidsglance.com/products/irheartembroiderytullenightgown-noirXmX1,https://assets.lightfunnels.com/account-99158/images_library/da6c04d1-ab68-4b6b-9388-b23e6d60f8a2.jpg,MERMAID'S GLANCE,Apparel & Accessories > Clothing > Underwear & Socks > Lingerie
prod_z4wpmLC21NZtMhAdJ5SQv,SERAPHINA – Noir Satin Kimono with Lace Detail - Noir,"Klasik. Yükseltildi. Seraphina. Kimonoyu yeniden yazar. Siyah saten tende kayar. Dantel yakayı zarifçe çerçeveler. Kollar ince işçilikle biter. Saten kemer silüeti tanımlar. Aradığın klasik. Sessiz zarafet. Doğası gereği sofistike. İçinde: Saten kimono, kemer.",in stock,new,66.00 USD,https://mermaidsglance.com/products/nanoirsatinkimonowithlacedetail-noir9xd7,https://assets.lightfunnels.com/account-99158/images_library/566322c2-6e40-4e38-96a5-a0ca67076a14.jpg,MERMAID'S GLANCE,Apparel & Accessories > Clothing > Underwear & Socks > Lingerie
prod_O6IIrallhtVIjd746boeE,ISOLDE – Noir Satin & Lace Open-Back Nightgown - Noir,"_*]:min-w-0""> Klasik. Yeniden. Isolde. Zarafetin en saf hâli. Siyah saten tende kayar; çizgiyi pürüzsüzce izler. Dantel dekolteyi çerçeveler. Ortadaki fiyonk son dokunuşu yapar. Tamamen açık sırt. Tül fırfırlar omuzlara hafiflik verir. Daima döndüğün zamansız klasik. İçinde: Dantel ve tül detaylı saten gecelik.",in stock,new,60.00 USD,https://mermaidsglance.com/products/noirsatinlaceopen-backnightgown-noirImBw,https://assets.lightfunnels.com/account-99158/images_library/7c1fa2fd-106c-4e93-8529-189b46861833.jpg,MERMAID'S GLANCE,Apparel & Accessories > Clothing > Underwear & Socks > Lingerie
prod_WhnO2S-NJ3YZrNfxzeZxm,CARLOTTA – Rouge Satin & Lace Back Kimono - Rouge & Black,"Kontrast. Cüret. Carlotta. Kontrastın gücünü fısıldar. Ön: akışkan, kusursuz kırmızı saten. Arka: tamamen açık, cüretkâr siyah dantel. Saten kayar, dantel omuz hattını açığa çıkarır. Ustaca bir denge. İçinde: Dantel sırtlı saten kimono, kemer.",in stock,new,60.00 USD,https://mermaidsglance.com/products/arougesatinlacebackkimono-rougeblackATTd,https://assets.lightfunnels.com/account-99158/images_library/977c3b89-3c01-4b91-b1ab-453100b5af6b.jpg,MERMAID'S GLANCE,Apparel & Accessories > Clothing > Underwear & Socks > Lingerie
prod_PtmLghfoCl1IJWV-AwxxW,EDINA – Noir Satin Kimono - Noir,"Zamansız. Noir. Edina. Sade şıklığın en net ifadesi. Siyah saten tende kayar. Renk her ten tonunu güçlendirir. Geniş kollar hareketi yumuşatır. Kemer beli toplar. Zamansız zarafet. İçinde: Saten kimono, kemer.",in stock,new,66.00 USD,https://mermaidsglance.com/products/edinanoirsatinkimono-noiry3vB,https://assets.lightfunnels.com/account-99158/images_library/32c48fbe-8856-4bbc-a8ce-bbe21d610ac3.jpg,MERMAID'S GLANCE,Apparel & Accessories > Clothing > Underwear & Socks > Lingerie
prod_sZlak3bQD8wX9iz-rN65M,LILIANA – Gray Lilac Satin Kimono - Lilac,"Yumuşak. Öz. Liliana. Sadeliğin en zarif hali. Lila-gri saten sessizce akar. Geniş kimono kolları hareketi yumuşatır. Kemer belde ince bir çizgi çeker. Dantel yok, şeffaflık yok. Satenin en saf yorumu. İçinde: Saten kimono, kemer.",in stock,new,66.00 USD,https://mermaidsglance.com/products/lilianagraylilacsatinkimono-lilacmPpx,https://assets.lightfunnels.com/account-99158/images_library/9644290f-1780-4447-b478-0ca579a1e4c8.jpg,MERMAID'S GLANCE,Apparel & Accessories > Clothing > Underwear & Socks > Lingerie
prod_owht-mW75I9XxkKCfyo4t,ILIANA – Noir Satin Open-Back Nightgown - Noir,"Sade. Zarif. Iliana. Yalnızca gerçeği söyler. Siyah saten tende sessizce kayar. Dantel yaka çizgisini ince bir hat gibi çerçeveler. Açık sırt, sadeliğin ortasında güçlü bir imza bırakır. İçinde: Dantel detaylı saten gecelik.",in stock,new,60.00 USD,https://mermaidsglance.com/products/iananoirsatinopen-backnightgown-noirX3Im,https://assets.lightfunnels.com/account-99158/images_library/a4ba69ce-c8bc-4d75-ae17-33472e163d95.jpg,MERMAID'S GLANCE,Apparel & Accessories > Clothing > Underwear & Socks > Lingerie
prod_GrZG1dp1MRK69RThw7qFv,BLANCHE – White Satin & Embroidery Nightgown - White,"_*]:min-w-0""> *]:pointer-events-auto scroll-mt-[calc(var(--header-height)+min(200px,max(70px,20svh)))]""> Romantik. İnce. Blanche. Yumuşaklık silüete dönüşür. Beyaz saten sessizce akar. Tüy işlemeli dantel göğüs formunu zarafetle çizer. Mevsimsel gül dokunuşu. Fırfırlı askılar feminenliğin yumuşak imzası. İçinde: İşlemeli saten gecelik.",in stock,new,69.00 USD,https://mermaidsglance.com/products/ewhitesatinembroiderynightgown-white43oO,https://assets.lightfunnels.com/account-99158/images_library/7bb67efc-fa99-4b9a-b06a-92d56e527180.jpg,MERMAID'S GLANCE,Apparel & Accessories > Clothing > Underwear & Socks > Lingerie
prod_5PRPZqiPN1t35_BVK8NJr,ROSALIE – Pink Satin Kimono - Pink,"Saten. Yumuşak. Rosalie. Özü hatırlatır. Saten teninde kayar. Pembe ton yumuşatır ve aydınlatır. Geniş kimono kolları akışı uzatır. Kemer belini sessizce çizer. Satenin en saf hali. İçinde: Saten kimono, kemer.",in stock,new,60.00 USD,https://mermaidsglance.com/products/rosaliepinksatinkimono-pinkCulw,https://assets.lightfunnels.com/account-99158/images_library/ce151983-f255-4a1d-81ec-0aad732c9136.jpg,MERMAID'S GLANCE,Apparel & Accessories > Clothing > Underwear & Socks > Lingerie
prod_Ad1GUGv-MRtdEty7IdhFu,SABINA – Classic Satin Nightdress - Noir,"Klasik. İncelikli. Sabina. Kusursuz dengeyi bilir. Saten tende akar, dantel bedeni ince bir hat gibi izler. Minik orta fiyonk kadınlığı fısıldar. Açık sırt, zarafetin içinde cesareti gösterir. İçinde: Saten gecelik.",in stock,new,60.00 USD,https://mermaidsglance.com/products/sabinaclassicsatinnightdress-noir3dhe,https://assets.lightfunnels.com/account-99158/images_library/e4341608-bd43-4132-af0d-c28339c6d3e5.jpg,MERMAID'S GLANCE,Apparel & Accessories > Clothing > Underwear & Socks > Lingerie
prod_c6oqYxMh9OA4tbb_vwjGI,INAYA – White Satin Open-Back Nightgown - White,"Saf. Saten. Inaya. Saf satenin sessiz zarafeti. Sade, akışkan, vazgeçilmez. Beyaz saten tende kayar. Dantel yaka çizgisini çerçeveler. Açık sırt, tek dokunuşla zarafeti cüretkâr kılar. İçinde: Dantel detaylı saten gecelik.",in stock,new,60.00 USD,https://mermaidsglance.com/products/yawhitesatinopen-backnightgown-whitesVqZ,https://assets.lightfunnels.com/account-99158/images_library/c2404e04-ec41-4c52-9731-569c9a877198.jpg,MERMAID'S GLANCE,Apparel & Accessories > Clothing > Underwear & Socks > Lingerie
prod_KyKFV07ySI3tZLgc7x0Ev,DALILA – Short Satin Cup Babydoll - Noir,"Kısa. Akışkan. Dalila. Hafiflikten doğan cazibe. Özgürlüğü cesurca kucaklayan silüet. Kısa babydoll kesim şeffaf siyah tülle buluşur. Saten üst ile ten rengi dantel arasındaki kontrast zarafeti fısıldar. İçinde: Kısa babydoll, uyumlu tanga.",in stock,new,57.00 USD,https://mermaidsglance.com/products/dalilashortsatincupbabydoll-noirZG1z,https://assets.lightfunnels.com/account-99158/images_library/f26469b4-8e4a-4d2d-bac8-46071ca551bc.jpg,MERMAID'S GLANCE,Apparel & Accessories > Clothing > Underwear & Socks > Lingerie
prod_6KTw71k5shYxXon8Vraul,NADIA – Sheer Tulle Romantic Nightgown - Noir,"Işık. Akış. Nadia. Hafifliğin romantik yorumu. Tende şeffaf, akışkan ve zarif bir tül hissi. Göğüs çizgisini nazikçe sarar. İnce işleme gösterişsiz bir kadınlık sunar. Her detay yumuşak, unutulmaz. İçinde: Şeffaf tül gecelik.",in stock,new,60.00 USD,https://mermaidsglance.com/products/adiasheertulleromanticnightgown-noirFgJE,https://assets.lightfunnels.com/account-99158/images_library/ed02bf3b-a6e1-459a-babd-89c230481626.jpg,MERMAID'S GLANCE,Apparel & Accessories > Clothing > Underwear & Socks > Lingerie
prod_qhOMAKFGsfkWxcOEzZkU0,FIORA – Short Tulle Nightie with Satin Cups - White,"Hafif. Kısa. Fiora. Kısa. Hafif. Cazibeli. Tülün ağırlıksız dokusu satenin zarafetiyle buluşur. Saten üst hafifçe biçim verir. Mini fiyonklar görünümü tamamlar. Nazik, kadınsı, kendinden emin. İçinde: Kısa gecelik, uyumlu tanga.",in stock,new,57.00 USD,https://mermaidsglance.com/products/shorttullenightiewithsatincups-white7vvN,https://assets.lightfunnels.com/account-99158/images_library/724ee227-75e7-4671-97f4-5de3446457ab.jpg,MERMAID'S GLANCE,Apparel & Accessories > Clothing > Underwear & Socks > Lingerie
prod_sG9majXIfh99eAsVKQZZT,MARIS – Navy Blue Halter Lingerie Set - Navy,"Lacivert. Derin. Maris. Koyu lacivertin asaleti. Cesaret zarafetle buluşur. Boyundan bağlama detayı silüeti yükseltir. Jartiyer kemeri çizgiyi inceltir. Sessiz güç. Kontrollü cazibe. İçinde: Boyundan bağlamalı üst, jartiyer kemeri, tanga, bacak bantları.",in stock,new,64.00 USD,https://mermaidsglance.com/products/marisnavybluehalterlingerieset-navyeGpH,https://assets.lightfunnels.com/account-99158/images_library/5d38b6b3-5d24-4b3c-9dde-33743e4dd530.jpg,MERMAID'S GLANCE,Apparel & Accessories > Clothing > Underwear & Socks > Lingerie
prod_ad0pGS3c8PimW35RHKQVb,KENZA – Four-Piece Choker Lingerie Set - Noir,"Cesur. Zarif. Kenza. Derin siyahın etkisi. Keskin çizgilerin sofistikasyonu. Choker ile bütünleşen üst silüeti çerçeveler. Jartiyer kemeri çizgiyi inceltir. Tek bedende cazibe ve kontrol. İçinde: Choker üst, jartiyer kemeri, tanga, bacak bantları.",in stock,new,64.00 USD,https://mermaidsglance.com/products/enzafour-piecechokerlingerieset-noirC6he,https://assets.lightfunnels.com/account-99158/images_library/b1167620-b729-4a45-8c45-c68e845b453a.jpg,MERMAID'S GLANCE,Apparel & Accessories > Clothing > Underwear & Socks > Lingerie
prod_oRTym0q42RAhd5K5BgtXq,LILIA – Ruffled Tulle & Embroidery Babydoll - White,"Romantik. Hafif. Lilia. Kadınlığın en zarif biçimi. Beyaz tül tende kayar. İşlemeli üst bedeni yumuşakça sarar. Fırfırlar masalsı bir dokunuş katar. Romantik, büyüleyici, unutulmaz. İçinde: Babydoll, uyumlu tanga.",in stock,new,60.00 USD,https://mermaidsglance.com/products/ruffledtulleembroiderybabydoll-whiteoVEA,https://assets.lightfunnels.com/account-99158/images_library/a2de98e9-a814-44d3-a010-e59355bcaf48.jpg,MERMAID'S GLANCE,Apparel & Accessories > Clothing > Underwear & Socks > Lingerie
prod_1puVfwKGzMN6BJwFpusZ6,ZOSIA – Dotted Tulle Bodysuit with Thigh Bands - Noir,"Biçim. Unut. Zosia. Body kavramını yeniden yazar. Siyah puantiyeli tül tene dokunur. Kesimler biçim verir, sıkıştırmaz. Bacak bantları bütünü tamamlar. Üzerinde olduğunu unuttuğun bir parça. İçinde: Body, bacak bantları.",in stock,new,80.00 USD,https://mermaidsglance.com/products/ttedtullebodysuitwiththighbands-noirkg9t,https://assets.lightfunnels.com/account-99158/images_library/4f73d5d3-4717-4199-871b-676262e93d76.jpg,MERMAID'S GLANCE,Apparel & Accessories > Clothing > Underwear & Socks > Lingerie
prod_08-bc0K-h2Z4mBlYhVMqL,RUBIA – Dotted Tulle Bodysuit with Thigh Bands - Bordeaux,"Biçim. Unut. Rubia. Body kavramını yeniden yazar. Bordo puantiyeli tül tene dokunur. Kesimler biçim verir, sıkıştırmaz. Bacak bantları bütünü tamamlar. Üzerinde olduğunu unuttuğun bir parça. İçinde: Body, bacak bantları.",in stock,new,80.00 USD,https://mermaidsglance.com/products/tullebodysuitwiththighbands-bordeauxFTJ4,https://assets.lightfunnels.com/account-99158/images_library/cd544726-5659-4133-9929-2b61efe8cc2b.jpg,MERMAID'S GLANCE,Apparel & Accessories > Clothing > Underwear & Socks > Lingerie
prod_g266ACHeeM_Cz9naLvJ8c,KAZIA – Full Lace Transparent Kimono - Noir,"Cesaret. Şeffaflık. Kazia. Baştan ayağa dantel. Hiçbir şeyi gizlemez; zarafetle ilan eder. Şeffaf siyah dantel tene dokunur. Saten kemer tek bir çizgiyle karşılık verir. İddialı, berrak, kusursuzca kendinden emin. İçinde: Dantel kimono, saten kemer.",in stock,new,69.00 USD,https://mermaidsglance.com/products/kaziafulllacetransparentkimono-noirl_XX,https://assets.lightfunnels.com/account-99158/images_library/ae2844c9-5d5e-497e-9621-b3496227fa3f.jpg,MERMAID'S GLANCE,Apparel & Accessories > Clothing > Underwear & Socks > Lingerie
prod_LEOGCI5VpnguCQ1Jdutra,NOEMI – Sheer Tulle & Embroidery Nightgown - Noir,Işık. Akış. Noemi. Şeffaf tülün akışı. Işığı yakalayan ince işleme. Göğsü nazikçe biçimlendiren büstiyer. Abartısız romantizm. Narin. Feminen. Unutulmaz. İçinde: Şeffaf tül gecelik.,in stock,new,69.00 USD,https://mermaidsglance.com/products/misheertulleembroiderynightgown-noirVkbN,https://assets.lightfunnels.com/account-99158/images_library/4c384dbf-f37f-4559-860e-cad05d8a5bc4.jpg,MERMAID'S GLANCE,Apparel & Accessories > Clothing > Underwear & Socks > Lingerie
prod_c_v1LnYR1rOUSB6a-3mxT,ELARA – Floral Embroidery Nude Tulle Set - Noir & Nude,"İllüzyon. İz. Elara. Tül tende kaybolur. Siyah işlemeler kıvrımları izler. Görünmezi görünür kılan illüzyon. Jartiyer kemeri silüeti toplar. Zarif. İşlenmiş. Hatırlanan. İçinde: İşlemeli üst, jartiyer kemeri, tanga, bacak bantları.",in stock,new,87.00 USD,https://mermaidsglance.com/products/loralembroiderynudetulleset-noirnudef-8a,https://assets.lightfunnels.com/account-99158/images_library/695a9db1-2bca-4fd8-9541-814d992a4b71.jpg,MERMAID'S GLANCE,Apparel & Accessories > Clothing > Underwear & Socks > Lingerie
prod_WJj57LyBDxl87koHfeMDe,FLAM – Lingerie Set Four Pieces with Gloves - Noir,"Karanlık. Yanış. Alev. Siyahın derinliği. Dantelin fısıltısı. Bedeni ateş gibi sessizce çerçeveler. Yoğun. Sofistike. Unutulmaz. Çiçek işlemeleri tende ince bir iz bırakır. İçinde: Üst, jartiyer kemeri, alt parça, eldivenler, bacak bantları.",in stock,new,80.00 USD,https://mermaidsglance.com/products/lingeriesetfourpieceswithgloves-noirtDaB,https://assets.lightfunnels.com/account-99158/images_library/2391b6dc-88a2-47df-bac1-2c684d61ca6e.jpg,MERMAID'S GLANCE,Apparel & Accessories > Clothing > Underwear & Socks > Lingerie
prod_aiIuNzndYIbIoQXSl0GzS,EMB – Three-Piece Lingerie Set - Bordeaux,"Şarap. Zarafet. Kucak. Bordo dantelin sessiz ihtişamı. Kesimler bedenle kusursuzca birleşir. Gösterişsiz cazibenin en zarif hâli. Yumuşak doku tene dokunur. İçinde: Üst, jartiyer kemeri, alt parça.",in stock,new,80.00 USD,https://mermaidsglance.com/products/embthree-piecelingerieset-bordeauxuZF6,https://assets.lightfunnels.com/account-99158/images_library/2f4ab307-f72d-4966-a8e5-4b47dfe28cfc.jpg,MERMAID'S GLANCE,Apparel & Accessories > Clothing > Underwear & Socks > Lingerie
prod_2ZJgzRc1K641CJ48-Zo96,AUDA – Lace Bodysuit with Thigh Band - Rouge,"_*]:min-w-0""> Biçim. Unut. Audace. Body kavramını yeniden yazar. Puantiyeli tül tene dokunur. Kesimler biçim verir; sıkıştırmaz. Bacak bantları silüeti tamamlar. Üzerinde olduğunu unuttuğun parça. İçinde: Body, bacak bantları.",in stock,new,87.00 USD,https://mermaidsglance.com/products/audalacebodysuitwiththighband-rougeZhA5,https://assets.lightfunnels.com/account-99158/images_library/567422aa-446d-4c21-8179-71e1d40c955f.jpg,MERMAID'S GLANCE,Apparel & Accessories > Clothing > Underwear & Socks > Lingerie
prod_fFxGLrQieIigHoLZATkHN,MIR – Lingerie Set Four Pieces - Rouge,"Kaybol. Belir. Mirage. Kırmızı işleme. Ten rengi tül. İlk bakışta kaybolan, ikincide bakışı tutan illüzyon. Tül tende erir. Kırmızı işlemeler dövme gibi açar. İçinde: Üst, jartiyer kemeri, tanga, bacak bantları.",in stock,new,94.00 USD,https://mermaidsglance.com/products/mirlingeriesetfourpieces-rouge__yw,https://assets.lightfunnels.com/account-99158/images_library/dc51125d-11ad-4e4e-a0b4-1e2037e3c99f.jpg,MERMAID'S GLANCE,Apparel & Accessories > Clothing > Underwear & Socks > Lingerie
prod_kmTYuz9Idn7EKeUrAKgS2,BLO – Underwired Bustier & Matching Thong - Rouge & Black,"Lüks. Güç. Blossom. Lüks iç giyimin özü. Kabartmalı çiçek işlemeleri. Ten rengi tül üzerinde siyah desen. Önde ve arkada altın kilit. Bir sembol değil; fısıltı. İçinde: Büstiyer, tanga, çıkarılabilir kilitler.",in stock,new,80.00 USD,https://mermaidsglance.com/products/wiredbustiermatchingthong-rougeblackrBkM,https://assets.lightfunnels.com/account-99158/images_library/181981d2-79ba-4b01-a11a-15c5707afa21.jpg,MERMAID'S GLANCE,Apparel & Accessories > Clothing > Underwear & Socks > Lingerie
prod_diTs0Q0xuCOiPXj7oGAeG,ORE – Three-Piece Set - Rouge & Black,"Cesur. Hükmeden. Orée. Kırmızı sınırları iter. Siyah kontrolü tutar. Arasında bakışı esir alırsın. Başka hiçbir sete benzemez. Siyah tül üzerinde açan kırmızı güller. Mücevher ışığı yakalar. İçinde: Push-up üst, jartiyer kemeri, tanga.",in stock,new,80.00 USD,https://mermaidsglance.com/products/orethree-pieceset-rougeblackdaPS,https://assets.lightfunnels.com/account-99158/images_library/3bf3ca4a-50d7-44b6-99b6-3b559933780c.jpg,MERMAID'S GLANCE,Apparel & Accessories > Clothing > Underwear & Socks > Lingerie
prod_WgdZplziC-86SabQKn2Pz,MIRA – Three-Piece Lingerie Set - Rouge,"Emir. İllüzyon. Mirage. Dilenmez. Emreder. Kırmızı seni izler. Ten rengi tül bedende kaybolur. Kırmızı işleme alev gibi açılır. Mücevherler ışığı yakalar. Bacak bantları çizgiyi belirginleştirir. İçinde: Büstiyer, tanga, bacak bantları.",in stock,new,80.00 USD,https://mermaidsglance.com/products/mirathree-piecelingerieset-rougeh5Ze,https://assets.lightfunnels.com/account-99158/images_library/4cfa3ccc-ea92-46a9-a407-7eb2b4f2623c.jpg,MERMAID'S GLANCE,Apparel & Accessories > Clothing > Underwear & Socks > Lingerie
prod_feRkf5LDAjqZnWD_xg0uf,SAFI – Set of Four Pieces - Rouge,"Işıltı. Kırmızı. Saphia. Dantel ışığı yakalar. Sen bakışları toplarsın. Mikro ışıltılı özgün kırmızı dantel. Işık tende dans eder. Çoraplar görünümü tamamlar. Işıldayan imza. İçinde: Işıltılı üst, jartiyer kemeri, tanga, çoraplar.",in stock,new,94.00 USD,https://mermaidsglance.com/products/safisetoffourpieces-rouge12XP,https://assets.lightfunnels.com/account-99158/images_library/ef071550-6984-413a-beb2-f6c93d43fde7.jpg,MERMAID'S GLANCE,Apparel & Accessories > Clothing > Underwear & Socks > Lingerie
prod_SSdMRSc3MsD4N06uLznmu,SAPHI – Four-Piece Set - Noir,"Işık. Dantel. Saphia. Işık ona dokunur. Bakışlar sana döner. Siyah dantelde saklanan mikro ışıltılar hareketle canlanır. Sessiz ama güçlü. Silüet yeniden çizilir. Aydınlık. Sofistike. İçinde: Işıltılı üst, jartiyer kemeri, tanga, çoraplar.",in stock,new,94.00 USD,https://mermaidsglance.com/products/saphifour-pieceset-noirAH_z,https://assets.lightfunnels.com/account-99158/images_library/ef92d461-936f-41b1-bc8f-15965a7a8d8b.jpg,MERMAID'S GLANCE,Apparel & Accessories > Clothing > Underwear & Socks > Lingerie
prod_x5v_wa-hoZmtTtLMEDmzi,AMA – Leopard Satin Two-Piece Set - Animal,"Gündüz. Gece. Amara. Günün iki yüzü. Tek bir bütün. Beyaz bir gömleğin altında sakin. Akşam ışığında başka. Pudra pembe leopar saten tende kayar. Siyah dantel iz bırakır. İçinde: Balkonet üst, Brezilya kesim tanga.",in stock,new,64.00 USD,https://mermaidsglance.com/products/amaleopardsatintwo-pieceset-animal5cGy,https://assets.lightfunnels.com/account-99158/images_library/3fdc06d7-7a2e-4149-b680-aec05ce322c3.jpg,MERMAID'S GLANCE,Apparel & Accessories > Clothing > Underwear & Socks > Lingerie
